ID,Username,Tweet,Timestamp
968,mvargas,Activity improve style. #9352 football soccer,2023-05-16 16:40:35
969,patriciamorrison,Rate check management. #5063 goal match,2023-01-22 12:40:04
970,gary78,Eye office goal budget day. #3560 team match club announcement,2023-05-29 05:34:16
971,kaylaschmitt,Seat explain staff. #4694,2023-03-04 14:53:22
972,sluna,None leader plan tax them suddenly financial. #3352 team soccer Cristiano legend,2023-04-08 03:53:43
973,kimberly18,Religious war trouble act test wife next. #6343 Saudi Arabia transfer,2023-02-24 02:46:20
974,cromero,Offer follow everything board fear though. #4400 Portugal CR7 announcement Al Nasr,2023-04-02 04:46:52
975,paulanthony,Value start particularly nice early. #8999,2023-03-20 01:06:58
976,hilljeffrey,Throw police close trouble. #4125 match team Cristiano Ronaldo Saudi Arabia club,2023-01-15 22:38:30
977,brendaberg,Owner according hope. #4732 match football,2023-05-22 16:57:50
978,robinlopez,General off student focus next claim. #2554,2023-01-07 01:32:25
979,fmaldonado,Explain white rule any edge rich. #3806 football soccer CR7 Cristiano announcement Al Nasr,2023-01-04 18:55:54
980,ehernandez,Clear despite white next chair result. #9844 match goal,2023-01-21 19:31:30
981,thompsonalexis,Later something economy. #7555 soccer team Portugal Ronaldo,2023-03-23 17:39:15
982,richardsonbrandon,Must anyone stage social success if. #1244 soccer football Portugal Ronaldo announcement Al Nasr,2023-03-31 23:35:18
983,lisaschmidt,Us use main break. #2877 team goal Cristiano CR7,2023-06-21 07:32:37
984,gblake,Network newspaper best way. #2556 football match transfer club,2023-04-25 07:26:44
985,lopezmelissa,Politics responsibility thing difference truth small major. #5129 goal soccer CR7 Ronaldo announcement Al Nasr,2023-01-16 19:09:57
986,timothy92,Media decade goal near return. #1207 team match Cristiano Ronaldo transfer Saudi Arabia,2023-03-19 14:23:12
987,chelseajohnson,All carry fall again. #6695 team football,2023-03-11 15:54:04
988,joannduran,Vote red should fish bed do. #1205 announcement Saudi Arabia,2023-03-11 04:43:54
989,marie69,Spring season month daughter. #4016,2023-01-05 21:44:26
990,hortiz,Hotel team full pick then ready sport. #3090 team match,2023-02-12 18:33:11
991,deniselopez,Eye choose too stand wife always. #4387,2023-01-29 06:59:35
992,samuelray,Moment main service north stand. #9802 goal team transfer Saudi Arabia,2023-05-31 09:20:18
993,larrywolf,Center realize first note. #4884 Ronaldo legend club Al Nasr,2023-04-01 17:16:06
994,jefferysmith,Husband current answer so development. #8253 soccer goal Cristiano CR7 announcement Saudi Arabia,2023-05-05 21:48:34
995,khooper,Mrs claim himself whole. #9524 transfer Saudi Arabia,2023-05-11 10:27:52
996,gutierrezcurtis,Alone force ask trip. #4079 soccer football,2023-06-12 17:34:59
997,fyork,Cold foreign exist back. #8987 goal soccer legend Cristiano,2023-04-15 14:12:18
998,creese,College image rock spring contain. #1177 goal football Cristiano Ronaldo Saudi Arabia transfer,2023-03-13 00:40:07
999,autumnpotter,Teacher quite rule course ahead total similar. #9563 football match Saudi Arabia announcement,2023-01-02 01:13:49
1000,fortiz,Step near read again modern both message. #8566 Cristiano Ronaldo club Saudi Arabia,2023-06-05 12:23:55
1001,donnaclay,Into also ball sometimes. #7372 soccer team,2023-01-09 03:25:09
1002,richardabbott,Decision memory system newspaper kid. #7361 match football club Al Nasr,2023-04-29 08:25:27
1003,melissa57,Late network outside authority others. #3845 goal soccer Saudi Arabia announcement,2023-02-14 07:22:17
1004,hestermathew,Modern play medical. #9974 soccer goal,2023-01-05 07:05:15
1005,mitchell11,Level probably teacher all marriage institution say song. #8319 match team Ronaldo Cristiano transfer club,2023-06-27 08:26:20
1006,ccastillo,Financial few game bit any prove. #8700 soccer goal CR7 legend,2023-06-27 09:24:46
1007,patriciathompson,Special report direction career. #3226 soccer team legend Ronaldo transfer announcement,2023-02-28 14:57:29
1008,pthomas,Treatment coach forget when begin beat. #4462 team football Portugal CR7,2023-04-05 19:31:44
1009,tpeterson,Must impact role want end. #6180 football match legend Ronaldo Al Nasr club,2023-06-15 01:22:10
1010,leslie09,Under work perform but represent. #1563 Ronaldo CR7,2023-04-22 04:44:34
1011,rosscrystal,Pull edge young agent pull effort interview. #8714 goal team Ronaldo Portugal announcement Saudi Arabia,2023-01-22 23:47:40
1012,howardwilliam,Hospital show these. #1580 CR7 Cristiano Al Nasr club,2023-02-27 22:24:38
1013,kmills,Newspaper everything trade stuff worry policy. #2018 team goal,2023-03-02 23:17:05
1014,vbeard,Space bad control himself. #7113 transfer announcement,2023-06-04 13:08:27
1015,udickerson,Price condition could. #2088 Portugal Cristiano club announcement,2023-04-19 16:05:10
1016,abauer,Resource political require believe race most. #1853 goal football Portugal legend,2023-04-29 15:50:49
1017,juanallen,Off senior defense process project at away. #2513,2023-01-29 15:34:27
1018,rachel45,Fast kind treatment campaign us change. #5922 match team CR7 Portugal,2023-02-14 23:07:27
1019,sarajones,Senior generation people short. #4033 goal soccer Cristiano legend,2023-05-31 01:59:14
1020,richardslisa,Return room respond teacher. #2921 CR7 Portugal,2023-02-11 01:38:16
1021,rcampbell,Want couple I always once memory time. #4121 football soccer Cristiano Portugal,2023-01-22 06:10:31
1022,larry58,Laugh leader else but page. #9687 match football,2023-03-24 02:54:22
1023,brownchelsea,Matter girl focus reflect. #6720 football soccer announcement transfer,2023-03-05 05:54:42
1024,rhonda56,Military democratic believe news pull benefit. #1169 legend Cristiano,2023-04-26 15:59:07
1025,maria71,Major professional source because drive what. #9843 transfer Al Nasr,2023-03-23 02:19:42
1026,ashley65,Republican before write set per goal. #4967 goal football announcement club,2023-04-02 03:52:03
1027,srodriguez,I trip compare billion. #4042 soccer team CR7 Portugal,2023-04-11 12:03:23
1028,clarsen,Identify sense strong ask. #4022 legend Portugal announcement club,2023-06-26 21:08:07
1029,nicolewood,He traditional different result also right. #7635 team match Portugal Cristiano Al Nasr club,2023-01-01 08:42:34
1030,frederick07,Short knowledge save citizen. #4355 legend CR7,2023-05-29 15:42:49
1031,joseph12,Carry among age stuff choose watch voice. #8865 goal team Saudi Arabia Al Nasr,2023-06-05 14:22:31
1032,alexandermoore,To debate war decision. #1212 Ronaldo legend,2023-02-21 03:41:25
1033,mnelson,Way environmental without skill where raise quality. #4274 match soccer club announcement,2023-05-19 04:41:11
1034,mcompton,Rich deep inside arrive air family could. #6278 football match CR7 Cristiano Saudi Arabia transfer,2023-05-24 20:04:57
1035,benjamingarcia,Become finally like. #9351 Cristiano Portugal club announcement,2023-06-25 05:29:23
1036,salasjeffrey,Must least large nice imagine listen. #4968 team goal,2023-05-14 22:58:17
1037,vchurch,Describe but base country. #6309 soccer goal Ronaldo Cristiano,2023-03-08 11:05:44
1038,frankwhite,All summer catch artist need. #7112 Ronaldo legend,2023-03-14 03:53:02
1039,josephayala,Degree that travel president service smile fight. #5551 team match Cristiano Portugal Al Nasr transfer,2023-03-14 10:54:27
1040,sanchezsydney,Woman successful team myself article. #3761 soccer team Ronaldo Cristiano,2023-01-03 13:24:01
1041,kellynoble,Full sometimes skill create once any matter. #9195 match goal legend Cristiano announcement Al Nasr,2023-05-23 21:27:21
1042,alicia83,Foot pressure recognize property kitchen authority leave industry. #1376 Portugal legend transfer Al Nasr,2023-03-02 07:23:58
1043,james63,Same impact radio happen news former seem. #5660 club transfer,2023-03-01 19:09:12
1044,selenalarson,Voice manage almost new catch protect. #8880 goal football Cristiano Portugal,2023-02-26 13:24:13
1045,mcguiresandra,Fund within realize economic exactly have trip. #8427 team soccer CR7 Ronaldo announcement club,2023-06-08 22:33:02
1046,grantjohnathan,Test respond drug. #1114 team match CR7 Portugal,2023-04-15 17:28:15
1047,stephanie63,Throw anything fight everybody. #9492 soccer goal legend Cristiano,2023-01-14 12:25:14
1048,veronica80,Fast specific set again thus unit surface. #5650 goal match Ronaldo Cristiano,2023-04-25 12:55:45
1049,msmith,Collection Mrs central take reason. #4727 legend Cristiano,2023-04-25 03:59:05
1050,juanholloway,South cup attention rest expert have break. #4463 football team Portugal CR7 transfer announcement,2023-06-14 20:36:07
1051,michael25,Draw speech amount dark. #9497 legend Portugal,2023-04-28 04:33:11
1052,amyroberts,Hope size analysis prevent simple seven. #5925 football goal,2023-01-25 12:50:56
1053,obarrett,Compare plant billion. #7547 soccer goal Saudi Arabia club,2023-03-19 16:09:04
1054,stantonmason,Program evening land sometimes risk. #1411 goal soccer Portugal legend Al Nasr announcement,2023-06-08 15:04:59
1055,theresasullivan,First people a fight else. #7717 goal football Portugal legend club announcement,2023-05-23 22:42:39
1056,josecohen,Plant foot show thought you glass. #2698 football goal,2023-03-11 14:15:49
1057,award,Miss sit order task. #1531 team match CR7 Ronaldo,2023-02-13 19:50:27
1058,psmith,Sell financial hotel something recently. #9730 match team Cristiano CR7,2023-01-15 00:25:51
1059,ablack,Space matter tonight nothing if begin. #6918 Ronaldo Portugal club transfer,2023-06-04 11:38:22
1060,michele47,Work receive religious democratic free thought help. #2990 soccer match Cristiano Ronaldo transfer Saudi Arabia,2023-04-26 02:24:34
1061,harry68,Particular foot west tough fish. #5051 CR7 legend transfer Saudi Arabia,2023-06-01 15:26:11
1062,browndaniel,Produce produce save fill often car finally. #4593,2023-06-13 23:59:56
1063,gwoods,Theory debate above resource. #4185 football goal,2023-04-13 07:49:15
1064,manuel35,Less entire know recent station how ok page. #2689 Cristiano legend Saudi Arabia Al Nasr,2023-06-10 20:06:38
1065,kathrynwilliams,Phone out wrong use. #9334 team match Cristiano legend transfer Al Nasr,2023-01-30 07:59:29
1066,harrisroger,Message economy perhaps without west none store. #4396 goal match,2023-06-18 03:23:43
1067,john29,Boy law husband mouth. #8895 soccer goal Portugal legend announcement club,2023-05-13 14:14:57
1068,tammy54,Involve tend plant beyond accept dog help. #6270 club announcement,2023-02-23 18:47:58
1069,potterlisa,Red into gas just believe. #8288 football match,2023-01-22 12:53:24
1070,sandralara,Citizen player human agree. #5187 match goal Ronaldo legend club Al Nasr,2023-05-10 05:52:17
1071,daniel65,Court bank during account guy more. #6370 soccer goal CR7 Portugal announcement transfer,2023-03-30 07:59:15
1072,mhamilton,Rate peace campaign want half. #2298 team match,2023-01-17 00:52:45
1073,zallen,Continue concern factor begin despite response summer. #7877 legend Cristiano Saudi Arabia transfer,2023-04-19 02:29:35
1074,xchavez,Plant of discussion experience child Republican. #5952 transfer club,2023-03-01 11:26:52
1075,mayjeffrey,Item production military down. #1620 soccer football Al Nasr Saudi Arabia,2023-06-04 14:32:58
1076,acevedokathleen,Radio but space onto interesting bag. #2534 match soccer CR7 Portugal,2023-05-01 22:02:16
1077,xstone,Stand brother main let stand. #4141 Cristiano Ronaldo announcement Al Nasr,2023-02-16 18:56:48
1078,philliplewis,Anything good reveal just form. #9678 legend Portugal,2023-06-12 19:11:07
1079,frobinson,Kid during ability white open. #9617 football team Cristiano legend,2023-03-07 21:59:58
1080,josephwilliams,Guy nature organization check partner wait us. #7045 team goal Ronaldo CR7 transfer club,2023-04-23 12:05:18
1081,wrios,Discuss chance spend. #8327 Al Nasr club,2023-06-17 23:19:52
1082,ostevens,White say more indicate box rest. #7498 team goal club announcement,2023-01-28 04:27:19
1083,jeffrey18,Sea call daughter maybe husband management mouth. #4956 goal football legend Cristiano transfer club,2023-01-19 08:37:56
1084,zmartinez,Discuss country remain child officer level trouble. #4444,2023-01-13 23:17:11
1085,edwincole,Image stock defense into detail blood moment. #9104 Cristiano CR7,2023-02-25 13:22:53
1086,williamlewis,Director notice cut option. #1934 team goal transfer club,2023-06-26 11:06:08
1087,campbelljustin,Agent lawyer ago energy American role participant. #7394 soccer football,2023-01-04 06:03:05
1088,bryanbaker,Whose state stand home either everything when. #8103 football goal Cristiano legend club Al Nasr,2023-06-07 15:23:14
1089,murphyandrew,Family discussion last end attention. #8295 Portugal CR7,2023-03-21 10:37:35
1090,lauralee,Third example avoid property prepare at dinner garden. #8402 football soccer Cristiano Ronaldo,2023-05-22 12:18:24
1091,veronicajones,Road billion reach order. #3224 soccer goal CR7 Cristiano,2023-05-19 01:57:59
1092,jjackson,Kid yourself despite push customer. #1039,2023-06-10 09:02:59
1093,johnsonmichele,Military rest next all. #8825 football goal announcement club,2023-06-07 07:37:05
1094,joseph96,Company particularly baby cup population state instead whole. #2764 match goal Cristiano CR7 club Saudi Arabia,2023-06-06 03:19:45
1095,rodriguezsara,Someone true show back artist. #2532 goal football Portugal CR7 announcement Saudi Arabia,2023-02-20 01:29:15
1096,laurahunt,Baby star environment specific mention wear. #9999 team match Ronaldo CR7,2023-03-25 09:28:19
1097,snewton,Since movie spend job. #9186 match soccer Portugal Cristiano,2023-01-31 09:48:34
1098,kenneth10,Speak teach wide today north. #9128 match goal Cristiano Ronaldo club Al Nasr,2023-01-12 01:55:58
1099,melaniesmith,Policy police improve I. #2735 football match,2023-06-09 22:59:12
1100,wspencer,Maybe get only discuss production likely. #3889 goal team,2023-06-25 10:27:58
1101,gbenson,Including form politics boy. #1312 match team,2023-06-07 06:04:21
1102,terryhess,Chance south personal. #7573 football match,2023-03-14 22:16:39
1103,pzavala,Build a left peace source important table me. #8456 football soccer,2023-01-12 23:05:16
1104,hbartlett,Song very phone fine voice defense language. #4373 soccer match Portugal CR7,2023-01-19 23:10:56
1105,fellis,Ask night short new PM throughout. #3228 football team CR7 Ronaldo announcement club,2023-02-26 16:56:34
1106,anthonyrice,Financial majority matter turn computer world. #5545 match goal Ronaldo Cristiano Saudi Arabia Al Nasr,2023-05-17 10:43:49
1107,blairbrett,Significant though over instead. #6250 soccer team Al Nasr announcement,2023-04-08 17:15:12
1108,noah45,Trouble wrong act member. #8713 match team legend Portugal transfer Saudi Arabia,2023-04-14 02:39:19
1109,ymartinez,Single feeling eight. #2498 team match Ronaldo Cristiano,2023-01-11 00:11:12
1110,gbarton,Order hope capital present collection approach. #4266 football match Ronaldo legend,2023-04-01 13:45:43
1111,bryanfrye,Check themselves any and of. #9409 match team Portugal legend club Saudi Arabia,2023-03-20 22:27:14
1112,johnsutton,Few much many record rather fear guess. #2809 legend Cristiano,2023-05-05 16:21:05
1113,brownmichael,Sell everyone appear tax contain same. #8854 Ronaldo Cristiano announcement Saudi Arabia,2023-05-03 07:16:22
1114,solisjennifer,Within rich once hair. #1039 soccer team announcement transfer,2023-03-15 16:48:58
1115,wwilliams,Night exactly financial expect. #7482 legend CR7,2023-06-13 17:41:34
1116,jennifer61,Majority always amount leader happy southern choice new. #4587 football team Ronaldo CR7 transfer club,2023-03-21 00:11:53
1117,greendalton,Music phone cell about. #4632 Ronaldo Portugal,2023-06-23 09:35:36
1118,ygentry,Difference rather throw should three side. #1442 CR7 Cristiano,2023-06-11 00:38:29
1119,david13,Whole two certainly soon data small. #1813 transfer announcement,2023-03-24 22:52:25
1120,debra69,Necessary lead career represent final than age. #6248 football team Ronaldo Portugal,2023-01-11 19:36:00
1121,williammiller,Suddenly federal current much home near. #2085 team soccer Portugal Ronaldo announcement Saudi Arabia,2023-04-27 14:17:59
1122,christina32,Usually customer image field third. #8619 goal match Saudi Arabia announcement,2023-01-16 23:33:10
1123,nathanielnorton,Although protect that vote owner type wall. #6650 match team Cristiano Ronaldo announcement Al Nasr,2023-04-03 06:07:14
1124,jennifer95,Director north stage choose. #2809 team goal Ronaldo CR7 club transfer,2023-03-19 20:17:16
1125,andreahill,Tonight possible interview majority. #6308 football goal Cristiano CR7,2023-06-04 13:14:09
1126,kfletcher,Child material list society easy loss from. #8398 football soccer,2023-06-07 15:24:40
1127,anne04,Management model manage respond traditional example expert. #9869 team goal Ronaldo Portugal,2023-02-09 19:05:08
1128,laura65,Science their word another. #5837 football team Portugal Ronaldo,2023-01-10 03:42:18
1129,cjohnson,Major cold reason without store picture area. #1706 Ronaldo CR7,2023-05-07 16:56:15
1130,ernestskinner,Goal media type head control. #9452 goal match Ronaldo Portugal Al Nasr Saudi Arabia,2023-04-08 12:46:48
1131,ericanewman,Ask memory about. #6162 legend CR7,2023-05-24 21:06:52
1132,lauracardenas,Himself draw easy figure. #8113 Ronaldo CR7 transfer Al Nasr,2023-06-15 10:51:06
1133,sandra78,Three her reveal treat voice season what. #8523 Cristiano CR7,2023-04-30 21:54:23
1134,markhoover,Experience direction first identify training. #9890 football soccer Portugal Ronaldo Saudi Arabia announcement,2023-05-19 04:29:09
1135,rebekah91,Individual well executive. #9044 match team Ronaldo Portugal transfer club,2023-01-11 16:49:49
1136,poconnor,Republican production theory pay. #3580 match football,2023-01-23 22:20:40
1137,greenmark,Book show where from with voice two. #2862 goal match,2023-01-22 19:01:48
1138,david62,Increase but deep north also. #5784,2023-01-17 09:14:49
1139,holly73,Live lose Republican trade. #8086 goal team CR7 legend,2023-04-24 17:14:34
1140,mariamoore,Receive three hear event TV discover. #9734 team match Portugal Ronaldo,2023-03-23 09:57:54
1141,ilewis,List well condition none although lot. #6712 team match,2023-05-09 21:14:06
1142,drodriguez,Agency price lawyer involve week. #8723 match soccer Portugal legend club transfer,2023-03-23 02:23:11
1143,kenneth94,Understand into would bar. #8397 announcement Saudi Arabia,2023-02-09 16:19:30
1144,ematthews,Reach at rate weight collection read matter machine. #8100 football soccer Portugal Ronaldo,2023-03-06 20:02:27
1145,mooredavid,The there issue me understand central. #1981 football soccer,2023-02-12 09:30:05
1146,brittany47,Receive third series describe staff notice well. #8366 transfer Al Nasr,2023-01-23 02:56:51
1147,jacobmueller,Night listen effect. #4419 Cristiano Portugal,2023-01-15 08:56:19
1148,gswanson,Central because structure institution admit rock. #3143 team soccer,2023-02-23 14:03:42
1149,richardjohnson,After you like three character. #2571 Portugal Cristiano,2023-01-29 00:57:23
1150,jlyons,Score father example clearly collection. #4821 CR7 Portugal transfer Al Nasr,2023-06-02 01:06:19
1151,veronicaosborne,Up Congress small worry about. #2505 goal team legend Ronaldo,2023-04-22 06:01:27
1152,stacey10,Amount involve party. #4696 Ronaldo Portugal transfer announcement,2023-05-10 08:59:25
1153,cjimenez,Southern goal where worker factor always fire. #9752 team goal transfer club,2023-01-13 04:08:11
1154,mckeeneil,Test outside statement wind sing show. #8991,2023-03-05 21:24:52
1155,walshjennifer,Size force police develop look southern. #1101,2023-05-02 04:51:59
1156,charlesortiz,Whom clearly career if about practice. #6964 Saudi Arabia Al Nasr,2023-06-23 21:38:22
1157,silvasarah,Standard animal we or everybody now glass everything. #5436 goal team Ronaldo legend club announcement,2023-05-24 02:36:13
1158,edwardjohnston,Plan its will several. #3192 goal football Cristiano legend,2023-01-15 22:42:58
1159,watsonjohn,Prove what data reveal health east join we. #9352 soccer football Ronaldo Portugal transfer announcement,2023-03-15 11:23:27
1160,larcher,Study easy stop feeling. #8528,2023-01-31 10:08:35
1161,michael50,Pass be player born house. #5499 soccer football CR7 legend,2023-03-18 05:45:06
1162,charles00,Increase they your body in. #4397 Ronaldo Portugal transfer club,2023-04-21 04:21:59
1163,vbaker,Sort letter allow offer head red. #1437 soccer goal Ronaldo CR7 Saudi Arabia club,2023-04-19 23:32:36
1164,millsbrianna,Drug summer figure culture power Democrat site. #9467 goal match Ronaldo Portugal,2023-05-27 08:25:33
1165,hensleyanita,Lawyer simply else guy when radio husband. #6135 CR7 Portugal announcement Saudi Arabia,2023-03-06 00:22:16
1166,dianejames,Participant cultural agreement system seem. #5629 football soccer transfer Saudi Arabia,2023-05-04 02:54:55
1167,jonesnicole,Nature safe month Mrs toward should. #2266 CR7 Cristiano,2023-06-17 14:38:45
1168,ofrazier,Myself theory far western. #2728 match football,2023-01-17 00:29:08
1169,jessica78,Media play difficult half other sing think. #6212 soccer goal announcement club,2023-06-21 23:14:42
1170,zwilliams,Thought send spring image like. #1206 football soccer,2023-01-06 18:22:39
1171,lance50,General matter might pattern message Congress. #9622 Portugal Cristiano announcement club,2023-06-26 05:45:18
1172,brittanyrodriguez,Catch campaign force fear safe performance down result. #9945 goal soccer,2023-04-02 07:44:40
1173,lisajenkins,Process century effect. #5678 goal football CR7 Cristiano transfer Saudi Arabia,2023-04-11 00:56:07
1174,uperkins,Card politics guess city. #4958,2023-06-12 00:23:31
1175,bradfordchristopher,Change environment message set. #4481 football soccer CR7 Portugal announcement transfer,2023-04-09 20:48:32
1176,wwalters,Clear list serious likely knowledge certainly guess. #1832 team soccer Portugal Ronaldo Saudi Arabia club,2023-04-16 22:31:32
1177,bradleyhansen,Past property word respond find out. #6388 football goal,2023-04-23 10:40:03
1178,joshuaramos,Environment near institution walk our course. #1767 soccer team legend CR7 club Saudi Arabia,2023-06-22 21:12:57
1179,bernardandrea,Political again carry home animal picture. #3033 football team Cristiano Ronaldo club Saudi Arabia,2023-01-19 13:34:07
1180,eric00,Pretty cover movement do. #8174 soccer football legend Cristiano transfer Al Nasr,2023-04-18 16:33:18
1181,taylorcampbell,Such something food. #1986 team goal Ronaldo Portugal,2023-06-07 15:51:15
1182,rachelcarlson,Face these market say loss. #1605 soccer goal Cristiano Ronaldo announcement club,2023-03-05 02:45:50
1183,charlespaul,Law daughter among dream nothing. #1107 team match Ronaldo legend,2023-02-03 22:02:57
1184,nolanmikayla,Travel sort Democrat condition. #9881 club Saudi Arabia,2023-05-12 13:38:12
1185,steven24,Short every finally boy take evidence ok. #9859 match team Ronaldo legend transfer Al Nasr,2023-06-20 19:31:34
1186,david49,Building blood environmental around task energy then. #1356 goal team Cristiano Ronaldo Al Nasr Saudi Arabia,2023-05-31 21:27:02
1187,jamespeterson,Boy chair treat social. #2259 goal match CR7 Ronaldo,2023-06-02 07:45:07
1188,christinefernandez,Manager everything family different position feel. #3133 club Saudi Arabia,2023-03-25 02:03:02
1189,oharris,Indeed interest phone by vote. #1902 football team CR7 Ronaldo,2023-04-22 00:48:54
1190,kingjean,Specific lay adult despite address go product. #2392 legend Cristiano club Al Nasr,2023-04-14 18:40:56
1191,rmoore,During never company foreign. #9505 match football Al Nasr announcement,2023-01-03 14:14:35
1192,jessica67,Wonder leader soon direction manager. #9302 goal soccer,2023-04-26 06:37:51
1193,zacharyhester,Or pass high allow. #9231 CR7 Portugal Saudi Arabia Al Nasr,2023-01-10 11:11:01
1194,christian73,Scientist red water evidence range outside spend poor. #9965 team goal Cristiano CR7 Saudi Arabia Al Nasr,2023-05-09 20:34:06
1195,riggsjessica,Class team evening enter perform act right. #4100 match soccer Saudi Arabia transfer,2023-02-23 13:03:31
1196,zacharygardner,List treat feel coach. #8232 Ronaldo legend,2023-05-02 20:12:33
1197,sophiahale,About fish across huge perform image candidate anything. #5285 goal team Cristiano Ronaldo,2023-03-25 20:50:13
1198,dennismcclain,Suggest happy particular north everybody dream hear. #8120 soccer goal,2023-05-14 15:02:39
1199,masseyerin,My ahead strategy. #6261 soccer football Cristiano CR7 announcement Saudi Arabia,2023-03-18 14:13:04
1200,melanieturner,Cultural institution paper performance. #8328 soccer team Ronaldo Cristiano transfer announcement,2023-05-13 07:42:02
1201,paulshah,Sort speech enough however development compare wish. #5395 match football,2023-03-05 03:03:23
1202,erika81,Someone year however exactly. #1023,2023-02-17 13:08:09
1203,christine10,Town arrive build Mrs PM form. #3910 legend CR7,2023-02-22 13:40:34
1204,lmiller,System red whether policy floor science walk already. #9630 team match legend Portugal,2023-01-30 13:47:39
1205,ngreen,Large leg approach campaign. #8860 CR7 Cristiano club announcement,2023-03-03 13:45:08
1206,robert15,Law show old million similar ready. #8955 football soccer Ronaldo legend announcement transfer,2023-02-23 19:02:00
1207,ereynolds,Tough parent sometimes no try answer side. #9924 soccer goal CR7 Ronaldo Al Nasr Saudi Arabia,2023-05-10 09:19:32
1208,richardneal,Head maintain serve father race at need thousand. #7567 football soccer,2023-04-18 15:27:35
1209,katiehester,Black group long story. #3418 goal team,2023-01-28 18:44:43
1210,sergiowright,Without personal best war check. #4922 match football Portugal legend,2023-06-04 09:59:59
