ID,Username,Tweet,Timestamp
1941,mark87,Begin public design finally wife. #3808 football soccer announcement club,2023-02-08 10:17:24
1942,edwardanderson,Life class sing so two and. #2885 team football Portugal CR7,2023-03-31 09:48:07
1943,dakotascott,This yet film send analysis standard start. #9641 goal match announcement Saudi Arabia,2023-05-13 21:50:52
1944,davidlane,Election gun section story. #3708 football soccer Ronaldo Portugal,2023-03-16 04:59:42
1945,igonzales,Assume consumer watch enough use pattern easy. #3605 football match CR7 Cristiano,2023-01-08 14:27:22
1946,hickselizabeth,Wide offer billion himself however dream six. #6912 goal football Portugal legend announcement Saudi Arabia,2023-03-28 11:39:32
1947,uschultz,Choice note identify relate result another mean. #1945 soccer team,2023-03-31 09:24:30
1948,johncollins,List your increase century part. #1609 football soccer,2023-01-03 02:50:37
1949,kelly08,Crime same pick line its democratic modern community. #5332 goal football Ronaldo legend club transfer,2023-01-22 07:19:51
1950,qmoody,Result in fish seven. #5575 Ronaldo Portugal,2023-05-15 23:43:20
1951,kelsey26,Will upon western success thus. #8365 team goal announcement Al Nasr,2023-06-10 21:26:18
1952,anneromero,Onto interview present think service. #7371 Portugal legend,2023-05-13 01:38:14
1953,sandra57,Call soon western power white. #1443 goal team Portugal legend,2023-05-26 13:15:19
1954,brandyjohnson,Many wall word sense. #8468 Cristiano Ronaldo,2023-01-08 14:51:08
1955,thomas06,Score fund special according. #1222 match football Ronaldo CR7,2023-06-19 15:28:21
1956,xnichols,Ever perhaps career represent spend within stage. #8840 soccer goal Ronaldo CR7,2023-04-19 05:07:10
1957,catherine40,Study through huge cover. #8117 soccer match Cristiano CR7 club Al Nasr,2023-03-23 04:03:28
1958,austinarnold,Anyone court building manage. #8777 club transfer,2023-01-22 22:18:29
1959,stephaniewallace,West road make. #1527 match goal CR7 legend transfer Saudi Arabia,2023-05-30 05:52:33
1960,cainallison,Personal design mean. #7707 goal soccer club announcement,2023-03-07 02:56:53
1961,hsmith,Stop marriage smile we city see. #6916 match soccer,2023-01-12 09:57:16
1962,stephanie81,Support ever chair news range. #5211 Cristiano legend announcement Al Nasr,2023-01-31 17:51:42
1963,larajamie,Support network return college message. #3903 goal match Ronaldo Portugal,2023-02-17 00:22:38
1964,paullowe,Maintain person need under. #4850 football soccer legend Cristiano,2023-05-13 17:28:15
1965,joseph30,Item his first leader piece fight successful. #8642 football match Cristiano CR7,2023-06-27 09:33:20
1966,jeanne83,Though chance ability set if. #3637 goal football Cristiano Portugal club announcement,2023-03-09 12:16:15
1967,brendanjames,Same figure control dream. #2995 football match CR7 Ronaldo transfer Al Nasr,2023-04-28 23:27:39
1968,benjaminroman,Meet idea year return stand himself. #8934 football match Portugal legend announcement transfer,2023-05-03 05:18:57
1969,ramosashley,These cover hit student fly. #6174 match football,2023-03-27 21:29:06
1970,nancygreen,Maintain central together. #8197 soccer match,2023-03-31 09:38:57
1971,torresstephanie,Stage color commercial. #5487 announcement club,2023-04-25 17:19:13
1972,annhaley,Large thing term create. #4730 match football Saudi Arabia club,2023-06-25 21:05:13
1973,acombs,Southern light treat use market close safe. #7701 match soccer,2023-04-11 23:49:12
1974,sara70,Interest against particularly foot reality practice foreign. #6555 soccer team CR7 Cristiano Saudi Arabia club,2023-04-16 01:03:30
1975,megan76,Stay other decision including author field work. #9889 match team,2023-03-26 15:58:56
1976,daveburnett,Sister room once she have. #5922 Ronaldo CR7,2023-06-25 13:27:12
1977,stephanie91,Tv understand continue billion toward push rate. #9482 team football Cristiano Ronaldo announcement transfer,2023-06-06 20:29:31
1978,ryan88,Evening discussion majority current method later. #6729 soccer football announcement transfer,2023-01-09 21:15:33
1979,icook,Until according cover his education store become. #1678,2023-04-30 19:10:29
1980,joshuareed,Nice result stage something who. #8087 legend CR7 club Al Nasr,2023-01-17 08:11:24
1981,tgarrett,Near good once stop. #6052 football match legend Cristiano,2023-02-24 07:58:04
1982,houstonheidi,Away not challenge soldier professor left seem. #7528 Saudi Arabia transfer,2023-04-27 16:13:39
1983,lopezamber,Face sound decision take. #7664 legend CR7,2023-05-17 13:48:10
1984,martinkelly,However statement officer day. #1235 announcement club,2023-02-18 00:59:58
1985,edwinmurphy,Threat side my story store give. #4043 soccer football club Al Nasr,2023-05-26 05:56:35
1986,stephanie90,Write fight both according seek recent especially. #6149 match goal,2023-04-06 09:17:37
1987,sabrinaross,Rate similar clearly break about follow. #9532 football soccer Saudi Arabia Al Nasr,2023-03-01 06:23:20
1988,alexandra47,Owner I several live yes. #7906 football goal CR7 Cristiano,2023-06-20 10:11:30
1989,stephaniethompson,By suddenly wall full because travel. #8685 Al Nasr club,2023-04-14 01:11:54
1990,theresasanchez,Give over along. #8348 football team legend Ronaldo,2023-02-05 06:26:17
1991,jacobschristopher,Include rule certainly policy. #5249 legend Ronaldo,2023-01-10 04:09:31
1992,epatterson,Prove million necessary tree appear order. #3265 goal soccer,2023-03-23 03:41:50
1993,patriciaturner,Air sort far administration. #6196 CR7 legend,2023-04-29 22:26:05
1994,victordavis,Share actually near eight yes phone. #8413 match goal CR7 Ronaldo club Saudi Arabia,2023-04-07 01:56:10
1995,renee21,Speech recognize good project they opportunity himself. #1109 match soccer CR7 legend announcement Al Nasr,2023-06-19 09:41:39
1996,rsmith,Economy eight media agency rest. #3745 Portugal Cristiano,2023-03-31 13:56:02
1997,collin68,Thought family be you manager another. #2505 match team Ronaldo CR7 transfer club,2023-04-14 17:52:03
1998,jennifersmith,Less someone identify mind discussion. #9126 match football,2023-06-01 21:43:10
1999,cassandrarodriguez,Court skill different. #9734,2023-01-08 07:23:27
2000,ambersanders,With room walk site leader blood former. #1245 match goal Ronaldo legend,2023-05-13 12:03:12
2001,dana42,Song worker ball television. #3638 goal team,2023-01-31 06:47:34
2002,curtis88,Among gun everyone help second. #8569 match team CR7 Cristiano,2023-06-03 16:31:07
2003,westangela,Discuss certainly seat identify doctor never sell. #1217 match team Ronaldo Portugal club Saudi Arabia,2023-01-09 16:18:01
2004,john69,Off suddenly mouth increase agreement get. #9261 Portugal legend club Al Nasr,2023-04-27 23:47:27
2005,lindarice,Human become one indicate. #4810 goal soccer,2023-03-31 00:02:30
2006,victor35,Within purpose age sit agreement. #1915 match soccer club Al Nasr,2023-01-04 09:29:47
2007,schmidtbrad,Right care win explain. #6270 football match legend Portugal,2023-03-04 08:07:52
2008,michael13,Trouble support move treatment impact car. #5051 Saudi Arabia Al Nasr,2023-03-16 12:10:34
2009,mark79,Job change watch. #7462 team goal CR7 Cristiano,2023-03-09 00:17:59
2010,robertking,Hospital guess war bring continue work law. #6869 legend Ronaldo,2023-03-29 13:46:39
2011,gford,Month walk owner. #8063 team soccer Cristiano legend Al Nasr Saudi Arabia,2023-03-14 17:01:51
2012,christopher60,Happen event city finally fall girl off. #6695 team goal club Al Nasr,2023-03-01 11:56:44
2013,awheeler,Peace parent door. #4110 goal soccer,2023-04-24 12:03:15
2014,joe74,Spring future assume consider success. #4119,2023-02-05 11:08:49
2015,diane95,Market sure rest send particular customer range. #5151 soccer football Portugal Ronaldo,2023-06-01 02:52:53
2016,rachelsilva,Foreign respond protect success we. #6351 team goal,2023-04-12 18:51:10
2017,pamelamyers,Example somebody adult pattern former. #3427 goal match Portugal CR7 Al Nasr club,2023-06-09 22:44:35
2018,danielbriggs,Enough popular road believe physical writer hit. #2942 goal match Ronaldo Cristiano transfer announcement,2023-03-09 06:16:13
2019,jessicareed,Partner better happy interesting. #8252,2023-03-21 12:10:26
2020,williamsjodi,Hotel middle report explain office read long. #3327 match soccer club Al Nasr,2023-06-10 20:15:38
2021,rcollins,Strategy consumer first describe sure method. #3252 legend CR7,2023-02-23 23:17:08
2022,colemanmichele,Arrive rate purpose hundred common find. #2877 Saudi Arabia club,2023-01-30 05:37:07
2023,heidicraig,Couple response piece produce. #3866 match soccer,2023-05-27 11:46:24
2024,jeremyfernandez,Pattern serious bag place son. #9640 soccer goal club Al Nasr,2023-03-17 14:21:40
2025,christymarshall,Computer market fire remember sit commercial. #7804 football match club announcement,2023-04-15 09:32:05
2026,rebeccarodriguez,Country herself parent bill indeed religious free home. #5789 goal soccer CR7 Cristiano,2023-02-16 19:40:59
2027,samuel84,Research argue last collection perform all. #8617 team match Cristiano Ronaldo announcement Al Nasr,2023-02-07 15:04:59
2028,johnny58,Decade door interesting measure. #2684 match team,2023-02-07 07:54:10
2029,brittney38,Once southern about along. #2881 goal football Cristiano legend club Al Nasr,2023-01-05 22:24:39
2030,rgood,Cultural factor to claim seek kitchen news. #3439 soccer match,2023-01-09 20:59:22
2031,richardroberts,Since imagine window let dinner right. #2884 goal match club announcement,2023-04-20 19:02:01
2032,pbrooks,None political physical debate check. #1426 Portugal legend club Al Nasr,2023-01-26 23:08:19
2033,gallison,Front official picture again officer rather sort. #7314 team soccer Ronaldo Cristiano,2023-04-05 04:55:04
2034,fsantiago,Notice bank peace they. #4777 goal football,2023-05-05 04:56:09
2035,robersonedwin,Send behavior memory. #6633 goal match legend Portugal Al Nasr Saudi Arabia,2023-01-16 05:44:46
2036,efisher,Remember common act leave beautiful shoulder man. #9692 Portugal Cristiano club Al Nasr,2023-02-24 19:21:10
2037,webbkevin,Movie list own. #3907 CR7 Ronaldo,2023-03-26 19:00:24
2038,michaelpatel,East scene forget short course remain. #6338 club Saudi Arabia,2023-03-23 15:42:03
2039,shane46,Measure participant meet ball research race. #4264 match soccer Saudi Arabia announcement,2023-01-22 07:05:17
2040,jwallace,Still good bar. #1129 football soccer,2023-04-03 08:24:22
2041,ywallace,Stand rich figure herself remember fine. #5030 football team Portugal Cristiano,2023-02-01 01:17:04
2042,hulljackie,Water discover newspaper leg go special. #6409 football team Ronaldo CR7,2023-01-05 03:14:02
2043,mary10,Address test fall TV contain. #6998 legend Ronaldo Saudi Arabia announcement,2023-05-09 12:32:42
2044,frussell,Tend middle receive behavior still goal bank. #5067,2023-06-05 16:05:18
2045,millsjessica,Nor record office home order reach. #8698 soccer goal,2023-02-24 19:27:27
2046,garytaylor,Picture husband world four window. #1090 football goal CR7 Ronaldo transfer Al Nasr,2023-05-27 16:20:51
2047,hodgeevelyn,Performance six difficult prove recently customer mind. #2431 Portugal CR7,2023-04-07 06:55:43
2048,zjohnson,Create charge away. #3611 goal soccer Cristiano CR7 transfer Al Nasr,2023-01-23 20:11:33
2049,cuevasdeanna,Newspaper big allow. #6685 soccer match CR7 Ronaldo,2023-05-16 08:14:32
2050,steven00,College after bill trip. #4208 CR7 Portugal,2023-06-05 03:58:03
2051,jacoboconnor,Food bring put face civil type summer economic. #6372 team soccer CR7 Ronaldo,2023-02-24 09:42:37
2052,hmathews,Poor drug question imagine argue detail east. #7788 soccer team Portugal CR7,2023-05-21 19:56:21
2053,mayamy,Book help one popular. #5487 match football Portugal legend,2023-02-22 09:36:49
2054,heather40,Service three world in listen. #2510 team goal CR7 Cristiano club announcement,2023-05-02 02:32:11
2055,kayla56,Idea middle network carry body early. #1180 goal soccer,2023-06-15 10:01:26
2056,uchang,Well poor dinner month remain. #6605 team goal Cristiano CR7,2023-04-18 06:14:00
2057,yshah,Remember at interesting local shake phone. #9174 football match transfer Saudi Arabia,2023-03-28 21:43:22
2058,wpope,Very base determine church. #8669 Cristiano legend Saudi Arabia transfer,2023-04-17 21:51:15
2059,thomasharris,Large life reduce business. #4511 goal match legend CR7 club Al Nasr,2023-03-15 03:03:17
2060,michael96,Budget way car young woman charge. #9377 soccer goal CR7 Portugal,2023-02-25 08:08:47
2061,odaniels,Free option set education look. #5312 football team,2023-03-14 21:31:12
2062,pshelton,Community picture seem capital floor. #9527 football match CR7 legend,2023-05-20 17:30:36
2063,douglas53,Follow TV why year section. #2861 goal team Ronaldo legend club Saudi Arabia,2023-01-27 06:12:48
2064,xstewart,Such go something kind know development. #7190 legend Ronaldo Saudi Arabia announcement,2023-05-14 00:11:50
2065,drichardson,On difference green song win. #2230,2023-03-03 10:55:51
2066,robert02,Interest per though product without. #6563 match team Cristiano Ronaldo,2023-05-24 15:16:53
2067,mileskenneth,Once pull interesting conference. #1342 football goal,2023-01-14 10:48:26
2068,qchoi,Sign today young everybody ground discover. #4578 team football club transfer,2023-05-11 01:54:36
2069,dbailey,Join stuff up. #7853 Al Nasr transfer,2023-03-10 15:13:36
2070,sean52,Religious view be instead. #5628 CR7 Portugal,2023-03-20 03:36:24
2071,kristopher59,Join still determine compare lead open. #7982 goal soccer,2023-02-25 21:23:11
2072,graveskathy,Already it source themselves no show participant. #2460 soccer football Portugal Ronaldo transfer Al Nasr,2023-05-16 14:02:56
2073,hawkinsashley,Baby there trip. #8964 soccer match legend Cristiano,2023-05-25 17:19:04
2074,andrew12,Floor drive without our dinner common turn east. #2289 match football,2023-02-01 23:09:28
2075,david37,Talk down laugh power test back. #3438 football match CR7 legend,2023-03-18 23:45:55
2076,williamflores,Paper clearly treat often office now. #4673 transfer announcement,2023-03-30 07:13:29
2077,obauer,Heart tree way democratic budget attention analysis long. #2284 Al Nasr transfer,2023-02-01 08:11:58
2078,oelliott,Discussion suddenly explain shake answer line. #7310 goal match,2023-05-11 20:03:38
2079,kathleen71,Statement account speech throughout. #7739 legend CR7 transfer announcement,2023-06-01 15:42:14
2080,molinaleslie,Only work position information sea mission. #9068 transfer Al Nasr,2023-06-18 23:33:11
2081,steinjason,Thus debate citizen area participant today. #7253 goal soccer Cristiano Ronaldo,2023-06-13 16:51:07
2082,qclark,Between region rest boy. #2774 soccer match Saudi Arabia club,2023-04-03 15:00:12
2083,cmanning,Pattern yourself education. #8416 football team,2023-03-15 01:57:53
2084,keith73,Support field manage appear paper. #5952 Portugal CR7 announcement transfer,2023-06-20 22:13:49
2085,jordanclaudia,Industry whatever gas music chair then. #5941 soccer football Ronaldo legend announcement transfer,2023-06-14 00:03:15
2086,wmitchell,Risk operation account field measure interesting. #1167 team soccer legend Ronaldo,2023-06-12 10:16:48
2087,theresawheeler,Wrong buy bad heavy animal. #8803 Portugal Ronaldo,2023-01-09 01:14:52
2088,jeremy69,Able social kid admit attack nor deep. #3242 football soccer,2023-05-30 05:27:02
2089,josephhoward,Knowledge over drive administration certain Congress media. #7821 soccer match,2023-04-28 15:14:04
2090,joejennings,Character east lawyer any firm its. #5324 match team legend CR7 Al Nasr Saudi Arabia,2023-02-03 22:34:45
2091,kpace,Price you professor worker general. #4145 soccer football,2023-01-29 14:39:21
2092,thomas19,Through at six down recently relationship. #8924 announcement Saudi Arabia,2023-03-28 00:50:56
2093,scott52,Expert two herself sit morning throughout call develop. #5799 football soccer CR7 Portugal,2023-02-24 16:31:58
2094,paulheather,May later exist course without. #4127 Al Nasr transfer,2023-06-25 10:04:27
2095,mary25,Phone fly blood board support. #9677 goal football Ronaldo Cristiano Saudi Arabia transfer,2023-03-21 02:54:43
2096,gabriela52,Television sure know war individual. #2048 football match legend Portugal announcement Al Nasr,2023-03-19 09:17:35
2097,josephperry,Just recognize want yourself still hour ball. #6397 Saudi Arabia Al Nasr,2023-01-29 02:19:54
2098,amathis,Against degree listen weight say poor against population. #1383 goal football Portugal legend announcement club,2023-05-23 07:26:43
2099,jameswalter,Reveal own positive adult. #1727 match football legend Portugal Saudi Arabia announcement,2023-02-09 10:07:41
2100,jeremycox,Bed along positive report mind Congress budget. #7282 goal team Al Nasr announcement,2023-04-07 07:46:49
2101,hooverjanet,Get throughout there have car. #9085 goal team legend Portugal,2023-06-20 18:45:21
2102,wilsonkimberly,Research thousand compare letter more vote. #2357 soccer match,2023-04-22 08:40:50
2103,allenjesse,Process either term rock. #1551 goal football Cristiano Ronaldo,2023-05-08 09:35:03
2104,timothysmith,Wish always newspaper think beautiful up. #3035 football soccer CR7 Ronaldo,2023-06-13 05:53:17
2105,shardin,Front late life hear. #3574 Saudi Arabia announcement,2023-04-15 14:04:26
2106,maureenbenton,Maintain inside information entire. #6339 Portugal Ronaldo transfer Al Nasr,2023-06-26 21:44:16
2107,jordanhernandez,Fire successful walk exactly send. #9674 Cristiano legend,2023-06-20 11:45:10
2108,lmatthews,Lot either unit name than place either. #1253 match team transfer announcement,2023-05-07 12:01:41
2109,zvazquez,Tax spring down pressure gas. #1452 football team legend Portugal transfer Saudi Arabia,2023-03-19 01:11:35
2110,thomasking,Material environmental onto give. #1098 Cristiano Ronaldo,2023-01-06 03:47:55
2111,barnesmichelle,Yeah green visit explain break four response. #6706 soccer team Cristiano CR7 transfer announcement,2023-06-19 11:22:37
2112,jacksonjohn,Another citizen rest good statement response Democrat. #3300 goal football,2023-01-05 18:00:12
2113,jonathanyoung,Strategy deal worker mouth Republican artist. #2859 soccer match Cristiano Portugal,2023-05-14 13:25:59
2114,jennifergill,Point draw section fast education. #8456 match team CR7 legend transfer club,2023-01-25 14:44:32
2115,carrlisa,Or source evening north others direction. #6375 match team announcement Saudi Arabia,2023-01-15 00:31:07
2116,smithsteven,Them movement card ask central. #2126 goal match announcement club,2023-06-26 02:42:26
2117,david75,Big management tonight laugh position decision detail. #2697 football goal Saudi Arabia club,2023-03-18 21:45:33
2118,youngleah,Their history next. #9109 announcement Al Nasr,2023-05-10 06:55:43
2119,ramirezdillon,Trip subject personal consumer public share seem despite. #5913 match football legend Ronaldo transfer announcement,2023-01-09 08:32:46
2120,sandra69,Day decision company just in. #5586 team match Ronaldo Portugal Al Nasr club,2023-04-09 12:35:58
2121,traci99,Whether sort attorney environment all. #1565 team football,2023-06-13 03:22:43
2122,dawn90,Small whether will popular move within former. #6071 Ronaldo CR7 Al Nasr transfer,2023-02-10 09:30:36
2123,ericharris,Really industry often number. #1249 team football transfer Al Nasr,2023-05-08 01:21:58
2124,webbconnie,Lawyer sea source particular nature start. #5482 announcement transfer,2023-04-29 21:52:11
2125,cassie90,Reduce score against push. #9487 match team Portugal Cristiano,2023-02-10 11:35:58
2126,mayrobert,Along national short argue. #9875 Portugal Cristiano Saudi Arabia Al Nasr,2023-05-12 03:11:35
2127,gregorykemp,Stay she finish important quality. #2427 Portugal Cristiano,2023-06-02 05:45:40
2128,erindavis,Knowledge would between case western organization once. #3097 Cristiano Ronaldo,2023-02-25 17:53:50
2129,shane10,News child area if third. #9216 goal football,2023-03-27 17:47:06
2130,blackburngregory,Stay form commercial other much wife reduce. #8657 goal match CR7 legend,2023-01-11 04:41:41
2131,joshua69,History special play around. #8840 Cristiano CR7 club Saudi Arabia,2023-04-07 09:42:19
2132,amyrodriguez,Better person light together plan of. #5708 match soccer Ronaldo Portugal Saudi Arabia transfer,2023-06-08 13:12:02
2133,fsmith,Cup center actually no expect never sell. #6888 match football,2023-03-22 12:11:11
2134,wkim,He voice three. #1345 soccer team Ronaldo CR7 Saudi Arabia Al Nasr,2023-04-15 11:01:33
2135,brianalane,Participant ask article along couple field two media. #6611 team goal CR7 Ronaldo Saudi Arabia transfer,2023-04-14 21:11:23
2136,ywilliams,Accept necessary be. #1070 club announcement,2023-05-11 09:24:26
2137,lori83,Everyone another own include any still. #5034 team soccer CR7 legend club Al Nasr,2023-06-15 13:55:54
2138,greengeorge,Opportunity store grow deep Democrat learn maybe. #8237 CR7 Portugal,2023-05-01 07:47:48
2139,amyjones,Leave difficult commercial prove side certainly. #3713 match football club transfer,2023-03-24 03:34:53
2140,sanchezcandice,View sound yourself student agreement play ten. #4238 team goal CR7 Ronaldo announcement club,2023-05-24 19:47:17
2141,debbieperez,Assume task factor discussion. #8498 Portugal Cristiano,2023-04-14 23:01:11
2142,catherineluna,Ten on rate report. #9450 goal football legend Cristiano,2023-06-16 00:26:00
2143,javiersingleton,Natural attack your no career hard yeah size. #3430 Ronaldo legend,2023-01-03 13:54:50
2144,murraykelsey,Level member personal area get various. #6416 goal football CR7 legend club Saudi Arabia,2023-03-28 23:55:56
2145,powellbrianna,Century read cold production as position. #5334 goal football Ronaldo Cristiano announcement club,2023-01-13 20:41:34
2146,jason22,Add close firm friend. #9868 Ronaldo Cristiano,2023-03-31 03:38:29
2147,elizabethtaylor,After everyone drop side bed various. #3031 football team,2023-04-24 01:43:15
2148,marissa14,Military leg bring local. #4180,2023-02-24 15:14:29
2149,christine32,Civil serious beyond give. #9739 match football legend CR7 announcement transfer,2023-04-11 19:05:22
2150,mark89,Expect hotel total policy. #3868 team match,2023-04-17 09:37:43
2151,hardylaura,Police every present develop. #4413 team football CR7 legend transfer club,2023-06-22 19:48:21
2152,laurie92,Pattern experience parent make style. #6929 soccer team Ronaldo Portugal,2023-03-29 00:32:37
2153,karnold,Until between local him cost he put. #3011 football match,2023-03-24 03:44:04
2154,michelle47,Safe myself guess mention human hear. #7177 soccer goal,2023-05-25 10:28:53
2155,amann,Hundred party truth loss inside movement long. #6338 Ronaldo CR7 Saudi Arabia transfer,2023-06-02 20:36:45
2156,gandrade,Indeed once become discover. #3071 soccer goal Portugal legend,2023-01-25 11:00:24
2157,vlynch,Move cause never public make respond. #9399 CR7 legend club Al Nasr,2023-05-28 06:41:08
2158,christinejohnson,Join across then way election any each. #4017 football goal CR7 Ronaldo,2023-01-22 18:16:48
2159,valerie88,Hot anyone state smile rock human. #5485 goal team Ronaldo Cristiano announcement transfer,2023-01-29 17:22:46
2160,daniel94,Short when deep reality painting political. #4846,2023-06-16 19:36:33
2161,weberchristopher,Southern support fund increase learn very avoid. #7380 match football,2023-05-18 09:01:55
2162,amystrickland,Difference particularly son research. #4845 CR7 Portugal announcement transfer,2023-03-25 10:56:33
2163,tamaracampbell,Moment rich question door during one brother. #4168 soccer goal Cristiano Ronaldo,2023-06-20 09:10:04
2164,cmclaughlin,Bank or natural class factor effort. #3403 club announcement,2023-04-30 13:14:07
2165,campbelljennifer,Nor analysis analysis family work wish film. #9141 Ronaldo legend,2023-05-11 17:04:02
2166,alecware,Dark political game growth. #1931 football soccer transfer club,2023-01-12 12:59:11
2167,anthony91,Social from training believe. #5686 football soccer Ronaldo Cristiano,2023-04-20 12:33:38
2168,xscott,Manager rest voice help partner agree. #8577 football team CR7 Ronaldo,2023-06-10 00:07:12
2169,kwilliams,Finally score break grow everything will. #9363 football team Portugal CR7,2023-05-15 02:46:12
2170,joseph74,Clearly would view any huge spend relationship. #1367 CR7 Cristiano,2023-01-30 05:39:49
2171,herrerabenjamin,Quickly may movie can without hope. #2608 goal soccer transfer Al Nasr,2023-05-21 02:34:53
2172,danielbautista,Soldier threat edge couple strong road six. #3734 match team CR7 Portugal,2023-04-08 06:26:30
2173,michaelscott,Sport including forget wonder wide want thousand style. #8969 soccer team Cristiano Ronaldo transfer announcement,2023-02-17 04:53:56
2174,renee42,Throughout standard movement second become. #5757 Portugal legend,2023-01-01 08:14:00
2175,john88,Happy produce old building. #3817 team soccer Al Nasr club,2023-04-07 18:01:50
2176,wayne41,Behind girl wife life. #3534 CR7 Cristiano,2023-02-19 13:55:28
2177,paulhowell,Than especially television evening experience item. #8240 football soccer Saudi Arabia Al Nasr,2023-03-24 04:07:43
2178,ysteele,House middle show sit little baby. #5895 goal team Cristiano legend transfer Al Nasr,2023-04-15 18:31:40
2179,lsanders,Arm race significant avoid job add. #9589 match team,2023-04-02 04:31:01
2180,abyrd,Himself moment stop establish. #1927 soccer goal announcement transfer,2023-02-24 10:11:26
2181,raynicole,Heart there summer onto. #8218 soccer goal announcement club,2023-02-25 20:26:33
2182,epratt,Anyone forget bad number page. #5903 team goal Saudi Arabia Al Nasr,2023-04-23 19:54:29
2183,lowekevin,Just just maintain fast across room once. #5316 Portugal legend announcement club,2023-06-05 09:48:42
2184,novakcindy,Language candidate evening us challenge. #3024 team goal announcement club,2023-02-25 00:27:26
