ID,Username,Tweet,Timestamp
2911,hutchinsonjamie,President artist event benefit garden. #7725 legend Cristiano,2023-06-20 23:30:59
2912,dennis05,Amount couple tend apply cell. #8613,2023-01-18 06:45:18
2913,carlosbarr,Eight American heart single activity structure operation federal. #9704 soccer team Saudi Arabia transfer,2023-04-04 06:46:49
2914,rdavis,College parent go half man official. #4311 match football Portugal Cristiano,2023-01-05 17:50:32
2915,ibradley,Discover strategy forward keep. #2568 goal team,2023-03-19 21:35:41
2916,tina31,Person seek single player. #3294 soccer goal legend Ronaldo Saudi Arabia transfer,2023-02-10 22:50:27
2917,ramosfrank,Cover summer safe measure your. #5097,2023-03-05 21:56:15
2918,joseph93,Yard her price person somebody. #6724 team match legend CR7 club Saudi Arabia,2023-02-18 18:04:44
2919,fosterdanielle,Man recent name recognize design claim. #6626 goal team legend Cristiano Saudi Arabia Al Nasr,2023-02-12 20:04:58
2920,greenjennifer,Teach exist at you. #7700 football soccer Portugal legend,2023-03-27 21:10:43
2921,mhaley,Discover just step. #9170 football goal Ronaldo Portugal transfer Al Nasr,2023-01-21 13:58:08
2922,kerrnathan,Present scene space ask I. #1142 soccer goal CR7 Portugal,2023-04-23 04:13:35
2923,russelljason,Improve star line source. #9100 team soccer Ronaldo Portugal transfer Al Nasr,2023-03-02 03:51:56
2924,timothybauer,Allow raise tree important suddenly across exist month. #9245 team match Portugal Ronaldo,2023-04-25 19:09:57
2925,nacosta,Guy mother manager. #4961 club transfer,2023-06-26 20:17:13
2926,jeffrey87,Suffer difficult pull. #8928 goal match Ronaldo Cristiano announcement club,2023-02-16 03:42:45
2927,duartepaul,Whose discuss walk beyond good push. #4488 CR7 Portugal club transfer,2023-03-27 04:52:16
2928,lindsey55,Case plant space system direction right. #9186 soccer match Ronaldo Portugal Saudi Arabia transfer,2023-04-12 13:19:56
2929,kvillarreal,Huge show around thank approach order. #7029 team match legend Cristiano transfer club,2023-04-06 19:54:25
2930,michaelmalone,Beautiful enter record million product first away firm. #8593 match soccer Saudi Arabia transfer,2023-06-11 00:22:09
2931,zsanchez,Or floor design authority. #6244,2023-04-23 23:17:45
2932,jamie25,Recognize occur tough claim. #5633 football goal Portugal CR7,2023-05-15 09:38:16
2933,ballrobert,Understand heavy front site radio own. #4736 Cristiano legend club transfer,2023-02-17 11:27:42
2934,jeffrey32,Third school stage city artist. #2120 team soccer Cristiano Portugal,2023-01-21 15:29:56
2935,deniseowens,Individual national well meet able. #6015 match team,2023-04-18 09:21:21
2936,jenniferwhite,Get senior late head magazine success almost result. #2084 Ronaldo Cristiano,2023-01-16 16:14:11
2937,contrerassandra,Hit parent around. #4803 team soccer Portugal CR7 transfer Saudi Arabia,2023-02-15 05:46:38
2938,xcharles,Although condition read sense. #5926 football goal club transfer,2023-06-17 15:47:35
2939,breannadavis,Fine key enough little. #4847 soccer match Portugal legend club announcement,2023-04-02 11:28:52
2940,travisnichols,May wait so guess room pay. #2216 goal team CR7 legend,2023-04-22 18:47:43
2941,hernandezkelly,Plant fly later another. #2948 soccer football Ronaldo Portugal,2023-02-14 02:58:38
2942,tina66,Shoulder they scene heavy everything financial carry. #5362 Ronaldo Portugal,2023-03-19 01:35:23
2943,woodlindsey,News safe sit between. #1783 match team Cristiano Ronaldo Saudi Arabia transfer,2023-03-26 23:44:09
2944,aknox,Partner never adult list surface positive fund. #4628 soccer football,2023-03-06 12:52:10
2945,ygreen,Suffer compare should guy dark action. #4357 Portugal legend,2023-02-14 00:21:04
2946,tbell,Structure join few point glass listen white. #1878 goal soccer announcement transfer,2023-02-14 00:41:48
2947,erikabrooks,Edge book present subject until clear. #9004 match soccer Portugal legend club announcement,2023-01-06 05:50:57
2948,ronald13,Morning although realize task law answer. #2321 soccer team transfer Al Nasr,2023-01-16 11:35:24
2949,leah59,Three accept world. #3020 legend Ronaldo,2023-03-17 03:38:56
2950,jacobhaynes,Protect sea somebody its management. #6167 soccer team legend Ronaldo,2023-04-24 21:58:39
2951,stevenhall,Small best gas. #5307 soccer team Ronaldo legend,2023-05-23 23:11:28
2952,lemary,Rock hospital tell American effect out. #6596 soccer goal legend Portugal,2023-01-04 00:21:00
2953,phamdonna,Care remain add consider writer state southern. #3043 soccer team transfer Al Nasr,2023-01-05 01:53:48
2954,timothyfields,Similar better work cover around or truth. #7147 legend Ronaldo,2023-01-31 15:34:50
2955,dnewman,Upon century face care. #5867 goal soccer Portugal Cristiano,2023-02-16 01:51:22
2956,tiffanybrady,Agreement financial second enough game now. #5959 Saudi Arabia club,2023-06-13 15:24:08
2957,trujillomichael,Join window throw read which action. #3147,2023-03-25 16:56:11
2958,kandrade,Myself usually cup price affect attention source. #3922 football goal Ronaldo legend Saudi Arabia transfer,2023-01-06 19:18:52
2959,arellanomark,Range lose close production black. #2518 match soccer legend CR7 Saudi Arabia Al Nasr,2023-01-15 11:11:45
2960,cwilliams,Seek itself yard type teach senior site. #7966 football team,2023-05-28 17:54:34
2961,jenniferperez,Field per in pay safe. #7805 goal football Ronaldo Cristiano,2023-02-18 11:49:20
2962,gallegosphilip,However nice whom range far fly. #4844,2023-05-08 18:08:45
2963,buckleyjustin,Local baby none animal yet argue. #1287 Portugal legend,2023-01-13 12:54:25
2964,costajohn,Impact imagine interview size. #9519 football goal Cristiano Ronaldo,2023-05-27 09:43:57
2965,dferguson,News shake religious bank vote impact somebody southern. #8651 team football legend Ronaldo club Al Nasr,2023-06-07 14:18:57
2966,jennifercross,Point similar government crime happy job reduce. #8194 match soccer,2023-01-16 01:30:50
2967,thomasfrancisco,Here drive hot continue evidence decide. #9523 soccer match Ronaldo Portugal,2023-01-06 23:33:47
2968,williamwallace,Sing PM television upon structure. #8819 Cristiano Portugal,2023-01-13 06:16:06
2969,kelsey47,Audience hour change direction. #2288 match football Cristiano CR7 Al Nasr transfer,2023-04-03 04:59:27
2970,christophershields,Sometimes return us through hold themselves. #2785 football team legend Cristiano,2023-01-04 18:45:58
2971,michaellynn,Reflect word news morning. #2008 team football Portugal legend announcement transfer,2023-06-08 17:27:33
2972,peterbell,Teacher member itself guy week feel which. #3676 CR7 legend,2023-01-23 04:13:36
2973,williamsmitchell,True data administration must according mind. #2188 soccer team,2023-01-18 03:21:19
2974,denisewilliams,Deal eye wind however draw race see start. #7900 soccer match Ronaldo Portugal,2023-06-05 03:26:43
2975,jensenchristine,Authority physical behavior character late natural election. #4255 Ronaldo legend Al Nasr club,2023-05-16 03:07:22
2976,hansenmatthew,State onto live no conference. #2837 match team,2023-01-22 20:47:24
2977,dennis64,Nor challenge significant series let. #1925 soccer football Ronaldo CR7,2023-06-07 12:21:58
2978,jacob94,During scientist on final baby chance save professional. #1567 soccer goal Ronaldo legend transfer Saudi Arabia,2023-02-15 17:14:23
2979,neil37,Know across push nation moment like plan. #4067 Cristiano Ronaldo,2023-04-11 11:26:32
2980,tescobar,End development food drive wind reveal yeah. #8337 CR7 legend,2023-03-15 03:52:26
2981,turnershari,After remain deep station conference everything important. #3820 soccer goal,2023-02-28 02:55:51
2982,wilsoneric,World control and draw arrive player. #1264 football match Portugal Ronaldo Saudi Arabia announcement,2023-02-21 17:20:12
2983,stuarthannah,Control story assume late impact Democrat film. #5688 team goal Portugal Ronaldo,2023-02-13 15:10:10
2984,ncraig,Go involve force start operation personal fear. #3889 soccer football Portugal legend,2023-04-17 04:58:11
2985,omolina,Republican stuff final hundred court. #1107,2023-05-08 00:10:53
2986,lindsay86,Any character for course evidence. #8310 announcement Al Nasr,2023-05-10 00:29:02
2987,thorntonjared,Executive street draw someone minute kind own page. #5868 Al Nasr club,2023-02-04 22:13:55
2988,mrodriguez,Sort recently exactly customer eye act. #8721 Cristiano Portugal,2023-03-07 00:51:54
2989,tscott,Statement part author foreign. #5423 match goal legend Portugal club transfer,2023-01-11 00:12:19
2990,dwalker,Nothing risk option watch health. #8632 soccer team legend Cristiano,2023-04-02 09:03:43
2991,robert19,Purpose forget method loss experience off. #1610,2023-04-16 22:05:28
2992,coxshannon,Ever along design also watch. #1273 team goal CR7 Cristiano Al Nasr announcement,2023-04-28 01:23:05
2993,david69,Later gas response through. #2583 football goal Portugal Cristiano Saudi Arabia Al Nasr,2023-04-17 22:17:24
2994,justinreyes,Forget base push how own. #9855 legend Cristiano Saudi Arabia Al Nasr,2023-05-10 02:28:28
2995,cunninghamsteven,Way well throughout subject. #5083 football match Cristiano Ronaldo Saudi Arabia announcement,2023-06-21 12:53:06
2996,margaret80,They east crime above whose. #2993 match soccer,2023-02-12 15:33:53
2997,mary74,Million way future whether wear. #2172 soccer football legend Cristiano transfer club,2023-04-04 22:11:42
2998,molly02,Professional toward direction allow true region. #6162 football goal,2023-05-08 04:02:10
2999,karenbarton,Enter nor visit go most thousand. #2974 CR7 legend Saudi Arabia announcement,2023-04-11 07:19:59
3000,jamesdoyle,Alone hospital specific herself. #2235 soccer team Al Nasr Saudi Arabia,2023-03-07 19:03:45
3001,mendezwesley,Recognize like another air four so him. #4872 Portugal legend,2023-01-13 08:44:55
3002,derrick98,Sense involve break deal firm. #4090 football goal CR7 Portugal,2023-04-03 09:06:26
3003,silvajustin,Allow cost accept reason. #1121 legend Cristiano,2023-06-16 20:59:13
3004,hwalsh,Actually system technology respond tonight author. #3706 match team CR7 Portugal Saudi Arabia Al Nasr,2023-05-26 20:43:37
3005,katherine70,Require agent last again town. #2526 Al Nasr announcement,2023-06-04 12:33:21
3006,thomasjackson,Remember song individual impact. #7328 soccer goal Portugal legend announcement Al Nasr,2023-03-16 11:42:51
3007,patricia15,Idea recently let image mother forget. #3257 soccer team Ronaldo legend announcement Al Nasr,2023-05-21 12:10:11
3008,heather98,Bed save fill article. #8342 goal soccer club Saudi Arabia,2023-05-04 12:52:27
3009,nicholas95,Decision cell foot tonight remain build short play. #5693 soccer football legend Portugal,2023-05-03 11:55:48
3010,tgeorge,Truth design dinner me. #9983 Cristiano Ronaldo club Al Nasr,2023-03-24 03:33:25
3011,williamlee,Thus cold leader image involve may including. #8047 team soccer,2023-04-07 10:40:11
3012,zhutchinson,Know physical require step western. #2847 Al Nasr transfer,2023-01-09 14:00:41
3013,michaelmclaughlin,Money hospital four if check bank. #7543 soccer football legend Portugal,2023-01-12 16:40:08
3014,thomasjudy,Also fight teacher medical where. #6200 Portugal CR7,2023-05-25 11:47:14
3015,stevengomez,Matter expect friend population bank spend. #5807 soccer team,2023-03-07 06:31:22
3016,james69,Training away manage home movie. #2897 match goal Portugal Cristiano club announcement,2023-05-29 16:47:50
3017,timothywade,Cut hot same city. #1865 team match CR7 legend transfer Saudi Arabia,2023-03-06 07:04:36
3018,mrobertson,Mrs itself manage sell cover field interview. #4429 Portugal legend,2023-02-18 15:30:38
3019,gpark,Defense wide lay draw. #9656 Cristiano Portugal,2023-04-19 20:01:05
3020,lopezsusan,Read not TV unit along. #3227 soccer football Ronaldo CR7,2023-04-05 16:23:03
3021,joseph60,Actually best civil third later hit. #1739 Ronaldo Cristiano,2023-06-23 19:34:25
3022,dudleydonna,Describe story night. #6981 goal soccer Portugal Cristiano Al Nasr Saudi Arabia,2023-02-18 19:58:30
3023,sara03,Development ready among society since physical. #7817 team football Ronaldo CR7 announcement Saudi Arabia,2023-03-09 12:16:18
3024,balvarado,Situation bed range building thought man. #3294 match soccer legend Cristiano,2023-05-25 17:17:36
3025,josephbeard,Wrong long that. #1500 soccer team Portugal legend,2023-06-17 07:30:37
3026,katherineclark,Defense quite exist shake see. #7235 match team legend Portugal,2023-02-09 21:09:01
3027,daniel80,Fear series too weight husband how. #4819 legend Ronaldo Al Nasr Saudi Arabia,2023-02-16 02:46:22
3028,scox,Face blood scientist leg most office little consider. #8779 team football Portugal legend,2023-01-20 12:50:02
3029,eric24,Argue year process current arm inside rest administration. #2556 goal soccer Saudi Arabia transfer,2023-01-02 08:29:49
3030,chad68,Discuss put try manager share up experience. #3202 team match Ronaldo Portugal club Saudi Arabia,2023-05-17 00:28:19
3031,holly02,What reveal respond the she. #4444 soccer football legend Cristiano transfer Al Nasr,2023-04-10 16:22:30
3032,thomasnathan,She edge always site performance. #6304 match football Portugal legend,2023-04-07 03:24:21
3033,jenniferwilliams,Policy nature upon be professional fight theory. #5128 soccer match CR7 legend announcement club,2023-05-25 03:30:42
3034,drobbins,Popular like rate huge hear might thought interest. #8760 Cristiano legend Saudi Arabia Al Nasr,2023-03-04 12:15:30
3035,lesliedavis,Room research item pull crime. #3845 goal team Ronaldo Cristiano,2023-05-12 20:06:56
3036,scott69,To machine hear. #2072 soccer team legend Portugal,2023-02-04 16:45:01
3037,hunterstephanie,Because moment true father since very. #5281 legend Portugal,2023-04-27 03:25:34
3038,wonganthony,Among ahead allow thing your interesting. #4737 team goal,2023-05-20 23:29:38
3039,perezcarol,World there all build economic. #9812 transfer announcement,2023-03-04 22:58:08
3040,ieaton,Author seem too skill. #9731 soccer goal Portugal Cristiano Al Nasr announcement,2023-06-14 13:22:32
3041,jenniferwolf,Newspaper bit lawyer kind mission stage professional. #3953 Cristiano CR7,2023-03-12 08:24:02
3042,greenjeremy,Sense participant which lead full he lose. #9186 Ronaldo CR7 Al Nasr Saudi Arabia,2023-01-23 06:41:51
3043,xcarroll,Visit read talk more. #8895 match soccer Portugal legend transfer Al Nasr,2023-05-10 02:34:04
3044,hstanley,Fact your reality although. #2114 team football Saudi Arabia announcement,2023-03-31 12:12:35
3045,natashahunt,Music in social hotel by. #7962 football match Portugal Ronaldo,2023-01-12 20:17:54
3046,chammond,Single least present. #6387 Portugal Ronaldo announcement club,2023-06-08 13:09:06
3047,sandra25,Check economic conference ground. #3433 soccer football legend Cristiano,2023-02-25 11:09:09
3048,vbradford,Save development however artist next effect catch. #3514 match goal Cristiano legend,2023-04-25 13:55:17
3049,leesanchez,School value involve grow cultural. #7004 soccer team Saudi Arabia announcement,2023-04-17 10:16:03
3050,sarahreid,Memory assume campaign rate cover record. #6974 team football Ronaldo CR7 transfer club,2023-04-30 08:58:26
3051,loganjennifer,Yet race score personal six life option. #7981 goal match legend Portugal transfer club,2023-03-02 13:13:08
3052,crystalmata,Remain participant miss organization under. #9560 football match Cristiano legend,2023-05-29 07:25:50
3053,nmckenzie,Their above cause time term. #1137 football team legend Cristiano,2023-03-25 16:50:28
3054,krollins,Group off in various. #8375 soccer football Cristiano CR7 announcement Saudi Arabia,2023-05-07 08:15:07
3055,michaelporter,Attack lay hair firm on treatment commercial. #6465 soccer team,2023-04-25 05:48:21
3056,freemanmichael,Care quickly issue painting policy two. #8920 football team CR7 Portugal Saudi Arabia announcement,2023-04-17 01:38:00
3057,rodriguezamber,Deal southern out down cold. #7435,2023-06-17 03:52:48
3058,alarson,Anything word eat then. #1291 Portugal Ronaldo announcement Saudi Arabia,2023-04-07 16:43:25
3059,tiffanywatson,Official service want behind. #7892 goal team,2023-05-26 12:17:16
3060,michaelbaldwin,While suggest benefit first author them four. #2363 Cristiano Portugal Al Nasr Saudi Arabia,2023-06-24 07:30:26
3061,lsnyder,Bag thank from tax threat. #6679 football match,2023-03-04 11:39:08
3062,moniquetucker,Century current hair serve bit central rule meeting. #9270 football soccer Portugal CR7 Al Nasr transfer,2023-02-14 12:17:41
3063,michael87,Somebody under product long. #6003 Ronaldo Cristiano,2023-05-22 07:53:32
3064,randybarry,Require month individual if. #7128 Portugal Cristiano announcement Saudi Arabia,2023-01-08 15:47:08
3065,annemeyers,Reality beat its maybe. #2090 club Al Nasr,2023-04-23 13:59:11
3066,uthomas,It similar phone movie. #5493 football match Ronaldo Portugal transfer announcement,2023-01-19 18:05:16
3067,jamestrevino,Soon partner decade fight shoulder a worker phone. #2181 goal team Cristiano CR7 club announcement,2023-05-04 01:09:42
3068,charleschavez,Series unit PM soldier trial chair myself five. #1909 goal match CR7 Portugal,2023-04-15 15:29:32
3069,michelle06,Decision among consumer four game together cultural. #7248 soccer goal Portugal Ronaldo,2023-05-26 16:14:32
3070,abrown,Approach heavy seat down. #1562 soccer football,2023-02-09 06:25:49
3071,kimberlypark,Notice hope usually head. #6381 team soccer,2023-04-05 18:36:37
3072,qmoore,Cost anything father tough fly agreement. #9469,2023-01-14 10:53:24
3073,melanienelson,Perhaps particular new western member whole. #9043 team match Saudi Arabia Al Nasr,2023-04-05 22:10:17
3074,james17,Someone half everybody sort good drive wait. #8182 match team transfer club,2023-04-03 15:47:50
3075,holmesryan,Realize let rock provide along detail company. #2883 football goal,2023-03-27 07:58:50
3076,timothyporter,Sometimes ready standard nation base represent late. #9658 team football,2023-03-31 09:26:00
3077,marissaporter,Economy customer small. #2720 soccer team club transfer,2023-01-23 02:10:26
3078,beltranmatthew,Sound movement smile run item pressure. #8168,2023-03-21 05:37:37
3079,randalldavis,Threat its feel experience party student human. #8365 football soccer club Saudi Arabia,2023-05-31 06:39:51
3080,weaverjennifer,Model save local six pretty fast office. #7706 team football,2023-04-19 21:46:43
3081,floydedward,Support southern eye cell. #7683 team football,2023-02-24 21:51:20
3082,crystal83,Visit say hope. #2696 Ronaldo Cristiano,2023-03-31 03:58:49
3083,fordwilliam,In state after may score. #5068 Portugal CR7,2023-04-28 06:31:46
3084,allisonmitchell,Idea describe subject agent range. #1540 match football CR7 Ronaldo,2023-06-11 19:05:13
3085,robert45,It seek generation college sound. #6951 football goal Cristiano CR7 announcement transfer,2023-02-26 15:43:19
3086,raymond58,Someone result once design serve mother thus. #9985 legend Cristiano Saudi Arabia announcement,2023-05-23 19:01:36
3087,carrbrian,Administration sort support research yet office tonight. #4635 football team CR7 Ronaldo,2023-04-08 20:15:57
3088,michelle59,Rate trial section day picture child wait. #8574 Al Nasr announcement,2023-01-16 06:32:44
3089,rodriguezalexandria,Industry minute goal move certainly general dark. #6465 team soccer transfer Al Nasr,2023-06-18 07:14:38
3090,lesterbarbara,True dinner eat arrive. #4872 football team CR7 Ronaldo Saudi Arabia transfer,2023-02-12 01:47:43
3091,michael86,Fill throw sport enjoy pay. #3249 football team legend Ronaldo announcement Saudi Arabia,2023-05-19 07:06:31
3092,dhall,Security discussion boy mention. #2345 football match Cristiano Ronaldo,2023-05-05 17:39:11
3093,williamgeorge,Any travel every. #7799 Ronaldo Cristiano club Saudi Arabia,2023-05-18 18:09:25
3094,bob67,He property carry police tough usually fear. #4191 goal team legend Ronaldo,2023-06-23 07:38:24
3095,ulopez,Affect get degree dark. #2722 football team CR7 legend,2023-06-16 06:10:06
3096,wesleywebb,Event prevent nice available. #4567 transfer club,2023-04-20 18:00:31
3097,rhonda42,Boy north entire action weight. #4065 legend Portugal Saudi Arabia club,2023-01-27 05:32:02
3098,johnsonrobert,Resource long fall thing city into today hospital. #1281 goal team Ronaldo Portugal transfer announcement,2023-05-26 14:52:50
3099,jessica72,No southern beyond describe senior actually. #5591,2023-04-19 07:00:06
3100,llittle,Class whom morning tend when. #7770 match football Ronaldo legend Al Nasr announcement,2023-01-07 05:05:45
3101,jeremycarr,Capital likely question activity move. #8745 goal match transfer announcement,2023-02-02 05:23:24
3102,gsimon,Ago happy citizen. #4056 CR7 Portugal announcement transfer,2023-03-26 16:53:06
3103,eblair,Later suddenly safe production catch carry five. #4585 Cristiano Portugal club Saudi Arabia,2023-02-16 07:01:34
3104,pollardelizabeth,Goal successful wonder discussion yes body. #2629 match goal,2023-04-29 23:21:26
3105,larrywest,Administration learn development. #4742 football match Ronaldo Portugal club Al Nasr,2023-05-12 16:07:11
3106,mario00,Hold total same manager somebody will coach. #8590 football goal legend CR7 transfer club,2023-02-28 09:11:29
3107,lisa25,Smile ball general evidence if relate threat letter. #7725 match football legend Ronaldo Al Nasr announcement,2023-01-14 15:20:05
3108,phillip08,Treat feeling rate rate. #7164 match football Cristiano legend announcement Al Nasr,2023-04-02 17:41:17
3109,rebeccajones,That learn theory notice. #7876 match goal,2023-01-08 21:58:20
3110,adam25,Represent affect five. #5346 team match,2023-05-20 06:25:52
3111,jamieperez,Institution data current however room model after. #5634 Ronaldo Portugal,2023-05-19 21:56:18
3112,danielle25,Phone woman medical get bar. #2587 goal team CR7 Cristiano,2023-02-10 22:37:30
3113,reyeskylie,Agreement church lot pattern. #1708 football team,2023-06-10 20:33:29
3114,jeremiah11,Avoid realize decide agent real. #6831 football goal Ronaldo CR7,2023-06-21 12:06:44
3115,joseph37,Real carry science although century. #5206,2023-03-05 17:53:00
3116,anthony63,Suddenly else pattern general. #8550 CR7 Ronaldo Al Nasr announcement,2023-05-14 05:15:17
3117,mario82,Painting owner drive. #9660 team goal Portugal CR7 announcement Al Nasr,2023-05-28 09:24:06
3118,silvamichael,Inside clear performance line police quite space. #3704 football team,2023-03-20 16:06:32
3119,ustewart,Local across which cultural. #3913 team match legend Cristiano announcement Saudi Arabia,2023-06-05 20:35:57
3120,ccochran,Sell while worry. #1946 football team announcement Al Nasr,2023-01-08 23:58:31
3121,mike98,Better issue change fund history. #5985 match football Cristiano CR7,2023-05-25 03:16:17
3122,dpitts,Attorney national herself feeling already. #3527 match football Cristiano Ronaldo,2023-03-24 18:56:15
3123,nwashington,Require career term knowledge evidence human. #8276,2023-02-13 08:42:52
3124,reginaldrich,Finish night any fly. #8083 football team Cristiano CR7 transfer club,2023-03-27 13:53:44
3125,jason17,Trade why product dream there later. #9870 football match,2023-05-13 09:11:43
3126,drodriguez,Size either my whatever. #9998 goal football legend CR7,2023-06-17 21:53:53
3127,nathanreynolds,Son wrong rather nearly try. #7980 match goal Ronaldo legend,2023-03-26 23:21:14
3128,jamescurtis,Professor treat guy service relationship protect. #9299 team goal Cristiano legend club Al Nasr,2023-03-24 02:52:43
3129,davidwhite,Customer read have include himself fact remember. #7071 legend Ronaldo,2023-05-01 17:40:35
3130,beckalyssa,Bit both production above our thus choice enter. #6087 announcement Al Nasr,2023-04-25 18:27:22
3131,meredithdavis,Event event your magazine test society far. #5929 Cristiano legend,2023-01-01 10:43:19
3132,xboyd,Adult woman lead help successful cover like. #5559 football match,2023-06-23 22:26:30
3133,walterscolleen,Into front church picture sea baby. #7741,2023-04-01 02:15:50
3134,jordancarroll,Tonight visit property if natural which pass. #4266,2023-01-05 03:37:40
3135,emily43,Century Congress dark behind soldier letter direction. #7657 match goal CR7 Ronaldo club transfer,2023-05-03 14:42:54
3136,ronald39,Consumer lose in worker conference. #3515 Cristiano Portugal transfer announcement,2023-02-26 03:19:02
3137,powellmary,More strategy crime baby evidence. #9461 goal team,2023-04-19 08:45:47
3138,gonzalesbarbara,System least land and home. #1197 team soccer,2023-02-01 09:10:17
3139,brownroger,They modern series. #9735 soccer team CR7 Cristiano,2023-01-09 06:55:49
3140,ashley78,Individual marriage expert never. #6614 football team Portugal CR7,2023-05-13 07:07:47
3141,stevensmith,Outside job west station do sea gun. #8468 legend Ronaldo,2023-05-27 05:30:28
3142,jessica44,Other prevent expect drive watch. #9659 football team legend Cristiano,2023-03-27 04:12:25
3143,williambarber,Subject similar knowledge contain staff understand. #6350 soccer team CR7 Cristiano club announcement,2023-01-03 14:42:22
3144,christopher60,Soon us collection walk nation throughout. #4241 legend CR7,2023-02-15 01:55:14
3145,harveyjoseph,Can nor able party board mention along. #3306 goal team Portugal Cristiano Saudi Arabia transfer,2023-06-12 14:35:19
3146,davidgarcia,Truth per market say. #8591 CR7 Portugal,2023-04-28 07:24:57
3147,millstyler,Activity back him movie sit. #6950 match soccer,2023-03-17 10:36:33
3148,maryrice,Surface method project second music. #9624 soccer football transfer announcement,2023-01-27 11:49:13
3149,nwilson,Board light much up member. #2891 team goal Ronaldo Cristiano,2023-06-09 13:49:54
3150,mannisaiah,Prevent change especially project address pass. #9704 goal match,2023-01-19 11:30:28
3151,michelle15,Sell behind may service magazine because. #5020,2023-01-26 20:19:16
