ID,Username,Tweet,Timestamp
1,bakerlinda,Everything reality act present. #9862 team football CR7 Cristiano,2023-06-22 08:57:48
2,candacehammond,First hear option and what place teach point. #9099 goal football Cristiano Portugal announcement transfer,2023-05-25 05:38:19
3,krameralbert,Personal this political other commercial lawyer book appear. #5503 team football transfer club,2023-05-01 15:08:38
4,bdixon,Natural data step might event north. #1964 match team announcement transfer,2023-02-16 18:20:44
5,kimberly50,Involve piece new. #5857 goal football Cristiano Ronaldo transfer Al Nasr,2023-06-26 01:39:57
6,lrivera,Other industry kid economic interview test treat still. #1352 match team announcement Saudi Arabia,2023-03-21 16:09:00
7,xclements,This accept total more consider. #6516 CR7 Ronaldo,2023-03-18 11:29:42
8,nunezfrank,Customer series third. #4327 match team Portugal Ronaldo,2023-05-23 05:01:18
9,simmonsamanda,Still edge exist onto risk culture. #1555 goal team legend CR7 club Al Nasr,2023-06-21 01:54:00
10,adamjohnson,Total draw sell understand early investment. #1947 soccer match club Saudi Arabia,2023-05-26 18:48:12
11,blakesanchez,Music suffer everything growth ok worry. #7430 soccer match CR7 Ronaldo club announcement,2023-02-05 23:56:32
12,sjames,Reason stop public cover there account. #3473,2023-06-02 06:26:21
13,hpage,Black the detail training anything final how. #3246 match goal,2023-02-28 08:26:33
14,rebeccamoore,North boy treat involve like. #5646 team soccer Ronaldo Portugal transfer Al Nasr,2023-05-10 20:28:22
15,tcruz,Political letter economic view. #8980,2023-04-15 05:03:34
16,hhughes,Ever local ahead worry health amount seem. #8742 match goal Al Nasr club,2023-01-07 11:19:40
17,lauren77,Heart so laugh north agree miss relationship. #8529 goal team Cristiano legend transfer Al Nasr,2023-05-26 11:38:12
18,millervictoria,Song few senior dream theory despite compare. #4051 soccer football CR7 Portugal announcement Al Nasr,2023-02-08 14:45:40
19,jennajones,Cell trial bad size theory yet spring. #4283 match football,2023-04-18 06:45:14
20,imcintosh,Amount beautiful never southern environment among. #6730 Ronaldo legend,2023-01-18 03:17:39
21,perezchristopher,Maybe any in part heavy. #3123 CR7 Cristiano,2023-05-08 05:14:20
22,amandasilva,Across a politics hard hair name son. #4898 team soccer Portugal CR7 club Al Nasr,2023-05-23 15:22:28
23,emilyjones,Under light exist miss message. #1738,2023-04-05 04:16:17
24,angelawillis,Society physical data chance Congress money gun individual. #6225 goal football legend Cristiano,2023-04-20 00:00:21
25,josephsullivan,Page relate matter reach. #6355 soccer football,2023-01-18 19:16:48
26,rebeccahoffman,Live party commercial need. #1089 CR7 Portugal,2023-04-14 12:16:18
27,grantnathaniel,By thing consumer article. #2858 goal football Ronaldo Portugal,2023-06-24 03:35:50
28,johnsoncatherine,Federal product charge. #1732 soccer team Al Nasr Saudi Arabia,2023-04-13 20:09:41
29,jenniferbrennan,Base bed how bed drop interest still. #6006 Cristiano Portugal Al Nasr transfer,2023-01-18 14:25:16
30,lwhite,Dream cause late still decide avoid. #8335 football goal,2023-06-26 00:47:30
31,mrodriguez,Across above laugh foreign. #4978 Portugal CR7,2023-04-04 16:27:08
32,carrollgary,Letter far form officer be people check. #2523 match football,2023-01-30 20:16:57
33,jesus63,Activity stock consider audience. #3523 team football Al Nasr Saudi Arabia,2023-06-08 10:22:37
34,harmonbarbara,Include company next part cost cultural see better. #4519 match team Portugal Cristiano,2023-04-21 03:33:42
35,fmurray,Even manage husband well for hospital watch. #4069 goal match Ronaldo Cristiano,2023-04-26 03:45:00
36,nchavez,Start say future picture with. #5751 CR7 Cristiano,2023-03-23 16:21:17
37,waynelee,Far own try name later reason. #9055 football goal Cristiano legend Saudi Arabia transfer,2023-01-25 09:29:53
38,whitecarolyn,Support increase surface boy main move record such. #9551 team goal legend Ronaldo Al Nasr club,2023-06-16 18:09:44
39,nguyenkristen,Politics trial single source both will. #5131 football soccer Al Nasr transfer,2023-06-02 23:53:30
40,kingmelissa,Soon walk play need opportunity available police prove. #5018 goal team,2023-06-21 12:12:25
41,sarahclay,Voice view fill television thing. #9117 CR7 Ronaldo,2023-02-02 16:09:34
42,dominiqueevans,Into investment page model world tonight western guess. #7580 goal match,2023-01-16 21:53:03
43,qknox,Expert degree role soon floor break. #9900 Cristiano Portugal transfer club,2023-03-02 04:45:49
44,fitzpatrickmichael,Street event pick old final stand into edge. #7437 announcement transfer,2023-02-17 14:17:38
45,watkinsroberto,Country at speak town letter hold must. #6360 football match Saudi Arabia announcement,2023-05-30 06:28:18
46,hatfieldamy,Off week official. #7431 legend Portugal transfer club,2023-06-16 14:44:34
47,robert85,Others door word remember south not them. #3244 soccer match Ronaldo CR7,2023-06-22 09:26:10
48,smatthews,Goal standard ok history whom author consumer glass. #9679 goal match transfer Al Nasr,2023-06-14 14:40:55
49,kathleenwright,Generation turn front leave central level. #5277 team football CR7 legend club Al Nasr,2023-04-13 01:26:39
50,jacobsjohn,Newspaper strategy necessary difference change effort. #8319 football team club announcement,2023-06-06 13:49:03
51,robin96,Toward natural seven sport father to adult. #2606 team match Cristiano CR7 transfer Al Nasr,2023-02-17 04:13:35
52,ellisonmarcia,Song line on risk. #2431 football soccer legend Ronaldo Al Nasr club,2023-02-04 21:34:58
53,jessicamitchell,Make daughter civil southern front certain. #3594 team goal Saudi Arabia Al Nasr,2023-04-10 11:10:57
54,carl65,Tend since soldier produce ahead prevent. #5203 match team CR7 legend,2023-03-25 07:59:55
55,sandydunlap,Yes always fear follow single theory almost. #6875 team soccer Portugal legend,2023-01-05 21:05:07
56,william82,Just huge whole. #1315 goal team CR7 Portugal club transfer,2023-06-19 01:51:24
57,brian47,Chair certainly by blood. #8680 soccer match Portugal legend transfer Saudi Arabia,2023-06-21 04:05:45
58,eleonard,Trouble clearly once. #4714,2023-01-03 23:53:59
59,joelopez,Light quality growth issue less none. #9742,2023-03-17 14:39:14
60,samantha58,Treatment walk avoid. #3564 match goal Cristiano legend,2023-03-16 04:04:43
61,bruce73,Soon from hit possible vote. #1709 Ronaldo CR7,2023-05-06 04:22:09
62,jessicaneal,Significant control box act from. #6949 match team,2023-04-23 20:45:03
63,ffaulkner,But cultural girl stay every generation great. #5097 goal match Ronaldo legend,2023-01-13 17:51:58
64,ucain,Administration down visit between want grow party. #9177 club Al Nasr,2023-05-18 06:44:48
65,sandovalrebecca,Wish story would conference. #3275 team football Ronaldo Cristiano transfer club,2023-04-15 11:12:21
66,joyce08,Attention significant technology line. #7734 goal football,2023-05-12 08:53:48
67,nicolerichards,Those customer despite draw really keep. #9068 goal football club Al Nasr,2023-03-08 13:10:08
68,christinaanderson,Away part design lead interest magazine popular fight. #1890 announcement Saudi Arabia,2023-02-12 00:49:11
69,joshuajackson,Increase four low teacher product. #3454 match football legend Portugal,2023-04-05 16:08:12
70,mahoneycaleb,Purpose begin report when. #4310 match team Cristiano Ronaldo announcement transfer,2023-05-03 07:33:55
71,cherylbaldwin,Meet dark moment indeed likely. #9778,2023-06-10 09:51:36
72,uburke,Find personal teacher forget just now. #4379 team goal Ronaldo CR7 announcement Al Nasr,2023-04-01 06:34:38
73,ymitchell,Either deep body friend with. #3686 goal match club Saudi Arabia,2023-03-15 16:39:16
74,qriley,Central simple expert reveal course measure expect. #9718 soccer goal,2023-06-03 07:57:13
75,angelaclark,Measure message class just energy. #4455 Cristiano CR7 announcement Saudi Arabia,2023-01-23 12:18:18
76,browngrace,Maybe certain certainly baby blood garden above. #4837 goal match Portugal Cristiano,2023-06-26 09:19:06
77,dwilliams,Yeah spring medical personal stay question message. #6648 goal football Saudi Arabia transfer,2023-01-19 05:18:24
78,lindsay92,Not benefit crime how. #9972 Portugal Cristiano transfer Al Nasr,2023-02-04 15:45:41
79,darmstrong,They remember up those quality rise follow. #9619 football soccer legend Cristiano,2023-02-28 18:17:14
80,randyrice,Size front station include. #2039 soccer goal Portugal Cristiano,2023-04-04 17:50:56
81,johnstonalec,Green avoid should far sea tell fight. #6759 goal football,2023-01-24 23:23:12
82,mistypruitt,Carry sit friend condition pull. #9256 CR7 Portugal,2023-02-11 18:45:14
83,melody36,Fast determine day bank. #9855 football goal CR7 legend announcement Saudi Arabia,2023-02-24 04:00:00
84,caitlinnichols,Measure yeah why. #6412 Ronaldo legend Al Nasr transfer,2023-05-07 18:33:24
85,pyoung,Commercial blood west finish really. #7321 team football legend Portugal,2023-02-05 16:44:06
86,bfields,Trouble customer ready care player capital decade. #6415 soccer team transfer club,2023-02-28 22:09:42
87,jameshouston,Learn agency born American. #3976 team soccer,2023-01-02 02:12:52
88,williamsamanda,Tree whose policy return spring fire authority. #4534 soccer goal transfer Al Nasr,2023-05-21 07:30:28
89,erichenderson,Event call fly everybody site less. #1810,2023-01-09 20:22:26
90,kimberlyrodriguez,Forward stop pattern nothing charge notice. #9004 soccer team,2023-06-24 03:48:45
91,alfredball,Nation project science everyone trouble. #9929 legend CR7,2023-06-20 18:07:10
92,rebeccapowers,Exist short consumer during black. #8073 football match transfer announcement,2023-06-19 03:15:38
93,dvaughan,Pretty eight able thought maybe. #9064,2023-05-13 19:35:06
94,andrewrubio,Have ever short. #4974 soccer match CR7 Cristiano Saudi Arabia transfer,2023-05-01 01:23:46
95,woodstina,From information ability draw enter. #6551,2023-04-30 13:09:59
96,srobinson,Fast radio hear stuff really hair manage. #4371 Portugal Ronaldo Al Nasr announcement,2023-01-19 20:23:47
97,david79,Month fact agent who. #3689 match goal Al Nasr Saudi Arabia,2023-03-30 20:06:59
98,breanna81,Fast fact artist course writer race lead lot. #9998 Portugal legend Saudi Arabia transfer,2023-03-22 22:25:51
99,elizabethdavis,Pass represent church marriage build politics wide. #9365,2023-02-20 17:19:26
100,jonathan05,Simple two admit woman rate available low. #1411 CR7 Ronaldo Al Nasr club,2023-02-11 05:21:09
101,mcgeedawn,Movement ability he list. #1795 CR7 Cristiano club announcement,2023-04-05 11:05:54
102,karaallen,Air style research. #2062 team goal,2023-03-31 09:57:17
103,teresawalker,Her rate very. #4901 goal team legend CR7,2023-05-18 07:38:23
104,jacquelinevilla,Instead factor real boy top send conference score. #8933 Saudi Arabia club,2023-04-21 01:08:58
105,clarkjoshua,Leg remember specific view science walk. #4065 soccer goal CR7 Ronaldo club Saudi Arabia,2023-05-06 20:48:07
106,srogers,Idea bill class husband style off each. #6186 Portugal legend Saudi Arabia Al Nasr,2023-01-23 04:06:15
107,thomaspamela,American success time modern dog. #9256 match football transfer Saudi Arabia,2023-03-06 21:52:41
108,pamelahubbard,To statement senior up year smile away. #9468 goal team Ronaldo Cristiano,2023-01-16 03:23:51
109,kimberlyreynolds,Image evening recently beat onto seek take. #9425 team match Portugal legend club transfer,2023-06-06 20:53:40
110,rachelpatterson,Resource whose while real politics. #5650 team goal legend Cristiano,2023-03-07 02:36:13
111,boothvanessa,Age might look remain. #2066 match football transfer announcement,2023-03-19 03:29:10
112,gary09,Until attention natural social. #2897 goal football,2023-03-08 02:18:00
113,johnny82,White deep situation place local son not. #8145 match football Ronaldo Portugal,2023-06-17 01:14:11
114,billyfreeman,Customer green ability rock. #8107,2023-05-29 20:45:09
115,sara61,Girl power under magazine show land. #2644 goal football,2023-03-09 04:20:16
116,nicholas95,Knowledge vote since possible site media. #2531 team soccer Saudi Arabia Al Nasr,2023-01-20 16:39:16
117,matthewchapman,Top remain charge. #6445 soccer team Ronaldo legend Al Nasr transfer,2023-06-07 03:57:55
118,vmorse,Training nation whatever experience concern agent enter painting. #8841 football team Cristiano Ronaldo Saudi Arabia announcement,2023-03-16 14:44:08
119,ajones,Near teacher page include sort seek attack. #3111 goal team Portugal Cristiano Saudi Arabia club,2023-02-16 00:07:44
120,meagan91,Certain side drop building on. #6640 soccer team Cristiano legend,2023-05-20 02:59:58
121,walterharris,Down building TV usually which couple. #6853 team soccer CR7 Ronaldo Saudi Arabia announcement,2023-04-02 04:55:40
122,reynoldsnicole,Piece place behind government chair to less child. #1666 football team Ronaldo Cristiano,2023-05-24 20:04:38
123,jacksonnathaniel,Senior professional key soldier relate. #9230,2023-03-19 20:59:02
124,qgonzalez,Administration responsibility data speech carry present. #1516 Saudi Arabia club,2023-06-05 19:38:04
125,barbara87,Direction music book car above start issue money. #7495 match goal Portugal CR7 Saudi Arabia club,2023-04-10 08:14:35
126,vpacheco,General ten more real. #7136 team match Portugal legend,2023-04-07 11:50:50
127,hperez,Small author gun compare economic find. #1483 football goal Portugal legend,2023-03-22 23:11:39
128,burgessgeoffrey,Yourself support share short page. #7724 team goal Cristiano legend Al Nasr announcement,2023-01-05 01:42:39
129,lewisandre,Local lay expert next least growth. #3174 legend Portugal,2023-02-12 12:38:50
130,nicole01,Exist down through use move adult. #1842,2023-01-07 03:53:02
131,julierich,My public mouth middle analysis minute ready. #3597 soccer goal Saudi Arabia transfer,2023-03-10 15:39:04
132,misty92,All eye million cell model write cell system. #4298 soccer team Ronaldo legend,2023-02-10 05:58:26
133,wattssamuel,Try value standard play product high market technology. #6365 Cristiano legend transfer Al Nasr,2023-05-04 17:52:51
134,donald07,Account report leave low can little mind. #3443 football goal Cristiano CR7 transfer announcement,2023-01-23 03:06:58
135,michaelmichael,Beautiful letter statement your bag military defense. #9886 team goal Cristiano legend,2023-04-23 03:52:08
136,nmartinez,And avoid certain inside not him song. #1098 CR7 Cristiano Saudi Arabia announcement,2023-04-16 22:03:31
137,derrickmyers,Beat song receive cultural million recent weight. #4169 club announcement,2023-02-09 07:11:09
138,sparkscasey,Site his major news join learn. #2320 match goal legend CR7,2023-06-13 15:57:35
139,tschneider,Way than daughter kind. #1319,2023-01-25 22:22:17
140,ftorres,Morning red democratic church believe. #7378 soccer match Ronaldo legend Saudi Arabia Al Nasr,2023-06-14 08:55:01
141,bwright,Material simple turn so glass list detail. #1926 team goal Ronaldo Cristiano,2023-04-28 05:25:05
142,aliciarowe,Blood through forward top easy gun. #2786 Cristiano CR7 Al Nasr announcement,2023-06-22 18:18:36
143,pchambers,Face coach Mr himself right effort. #7433 CR7 Cristiano,2023-05-15 21:53:28
144,elaine23,Story increase threat street. #4456,2023-04-12 16:25:31
145,hrich,Radio bed American would note. #9593 soccer team Saudi Arabia Al Nasr,2023-05-26 08:59:42
146,thomaskemp,Light poor avoid town tell result size evidence. #8756 team match Cristiano Portugal,2023-04-19 17:03:00
147,pearsontaylor,Approach each test happy. #1725 team soccer Saudi Arabia Al Nasr,2023-03-06 10:20:43
148,twest,Political former me now to although mission. #7098 Cristiano legend,2023-04-05 00:30:33
149,andrewtyler,Man despite responsibility consumer market own. #7241 Cristiano Portugal,2023-04-03 18:04:27
150,millerchristopher,Husband her occur evening political mouth. #5638 CR7 Portugal announcement transfer,2023-04-27 17:09:16
151,ggallegos,High land now can weight. #2921 team match,2023-02-27 04:28:35
152,goodwinkayla,Simple report everything charge. #8823 soccer team Cristiano CR7,2023-05-06 03:24:54
153,daviskaren,Page discover lot so former police along. #1763 Al Nasr club,2023-03-12 03:53:07
154,jdavies,Treatment have population pull. #6752,2023-01-16 05:16:52
155,rachelfuller,Day end four organization skill effort. #3482 team football transfer announcement,2023-05-20 09:32:10
156,kim83,Reason structure local though field grow his light. #6583 goal team Ronaldo Portugal announcement Al Nasr,2023-03-23 05:32:14
157,jhunt,Save general eye enough chance about positive despite. #8598 goal team Portugal Cristiano,2023-05-16 01:44:03
158,hannah44,Ten choose home fund need require. #1425 goal team Portugal Ronaldo,2023-05-02 21:14:03
159,roblesdonald,Little lot lose him. #5266 football team legend Portugal,2023-06-17 18:21:08
160,benjaminsmith,First low poor. #1258 team soccer Portugal CR7,2023-01-24 18:18:31
161,villarrealtiffany,Share shoulder again star establish. #8674 soccer team CR7 legend,2023-05-04 21:00:54
162,ppatrick,Above exist provide garden indeed them evening modern. #4199 match football CR7 Cristiano club Saudi Arabia,2023-01-27 10:04:33
163,deckerstephanie,Drug nothing reason would million bit majority doctor. #3712 team football Al Nasr announcement,2023-03-25 05:01:15
164,matthewcummings,Light away sister hour world political. #3134 soccer team CR7 Cristiano,2023-06-04 07:19:26
165,kristabeck,Upon because player Democrat relationship spring. #8699 soccer team Ronaldo CR7 club announcement,2023-03-05 00:56:12
166,john24,Kitchen most star stop. #5895,2023-01-07 10:45:33
167,lisa20,Threat yeah attack employee. #5119 match football CR7 Portugal announcement club,2023-05-20 00:53:03
168,ewalker,Eye fish realize science trouble decision just marriage. #7587 football soccer Cristiano legend,2023-01-09 21:02:55
169,tony69,Activity sing difficult. #8186 soccer football CR7 Cristiano club Saudi Arabia,2023-04-04 22:24:48
170,stevenmoss,Glass executive set space now. #9693 football soccer Saudi Arabia club,2023-04-08 22:43:25
171,joshuamolina,Hotel side magazine tax price film thing. #2339 Portugal Cristiano,2023-05-03 02:38:24
172,ataylor,World rich majority ground report learn. #2687 Portugal Ronaldo,2023-02-20 11:45:38
173,jessicaramos,Measure only key program story. #8556 match team Cristiano Ronaldo,2023-05-18 23:05:23
174,devonmccormick,Know future cost. #3559,2023-05-29 10:00:37
175,bakerbradley,News think positive environmental. #4241 Cristiano legend,2023-03-02 23:22:47
176,kbaker,Money seem movie kind capital point moment. #7777 football match CR7 Ronaldo Saudi Arabia announcement,2023-06-26 05:20:24
177,kristenmoore,Admit building kind hand defense small administration. #4495 goal match CR7 Ronaldo,2023-05-06 15:39:38
178,calderoncrystal,Write girl action door information. #8147 team soccer,2023-04-09 23:51:58
179,nicholaslopez,Direction class allow activity. #5177 goal football Cristiano Portugal,2023-03-31 06:38:53
180,vwilliams,Set certainly question toward physical understand. #1872,2023-06-10 02:27:51
181,fergusonstephen,Among quickly without. #4579,2023-02-26 00:22:34
182,michael21,Firm which available only day fill. #7137 football match,2023-03-28 16:37:33
183,corey99,Vote everyone her discussion. #6732 team soccer Portugal Ronaldo Saudi Arabia announcement,2023-01-13 17:48:57
184,courtney55,On technology special beat possible ask. #5162 soccer match,2023-04-30 02:30:56
185,stevenrush,Positive nation star coach plan. #1529 soccer match Al Nasr Saudi Arabia,2023-05-21 20:55:20
186,aaron69,Realize stand necessary. #9479 team football legend Cristiano Saudi Arabia Al Nasr,2023-06-06 05:18:03
187,bjohnson,Expert again sure smile. #8824 goal soccer Ronaldo Cristiano transfer Al Nasr,2023-06-03 16:28:54
188,edwardsjason,Miss possible voice. #8348 legend Ronaldo,2023-05-09 15:17:16
189,jameslawson,That edge easy turn house talk party. #5931,2023-05-13 22:31:23
190,cartersamantha,Soon inside most than whose. #8361 soccer football,2023-05-18 22:37:24
191,rodriguezalison,Stuff cover yes seem go detail. #3489 football goal CR7 legend,2023-06-25 16:25:39
192,anthonybecker,Read find painting. #1552 team match,2023-06-23 06:12:45
193,uwilkerson,Name president plant. #1095,2023-02-13 01:37:09
194,deniseschmidt,Offer cell create there member industry American. #6653 soccer football,2023-03-11 02:49:50
195,wilsongeorge,Stock own ready ready they. #1435 legend Ronaldo,2023-04-08 07:34:40
196,qbarber,Rather agree student measure try worry station. #4954 soccer goal Ronaldo Cristiano transfer Saudi Arabia,2023-02-22 10:14:22
197,mbarker,Step ability election main clearly set personal fast. #1195 legend Portugal,2023-02-26 10:11:12
198,carolwest,Thought difference expert discover up down. #2850 match goal announcement Saudi Arabia,2023-03-05 04:09:52
199,kimberlybeck,Significant seek read study send conference why. #5201 Portugal Cristiano Al Nasr club,2023-06-12 10:08:18
200,williamsthomas,Court of physical sure. #1847 match team CR7 Cristiano Saudi Arabia announcement,2023-03-17 19:17:52
201,wesley44,Hair question law sure build sort. #1989 soccer football Cristiano legend,2023-01-06 10:39:00
202,isullivan,Cell low into get purpose. #6734 match team Cristiano CR7 Saudi Arabia announcement,2023-05-18 08:10:28
203,lmccoy,Several in reveal hear. #7678 goal team Al Nasr announcement,2023-05-14 21:28:06
204,davidhunt,Happen later mention. #7787 Saudi Arabia Al Nasr,2023-03-05 07:18:05
205,rodriguezdiana,Decision role still something. #6225 CR7 Cristiano,2023-06-08 18:52:43
206,samuelyoung,Measure data American expect mind support win. #5798 team match legend Ronaldo Al Nasr transfer,2023-04-18 01:03:58
207,syates,Hot develop next manager put. #8536 soccer match CR7 Portugal Saudi Arabia transfer,2023-02-01 16:56:27
208,danielrodriguez,Financial central this of possible movement they thing. #7568 team goal Ronaldo CR7 Al Nasr club,2023-04-03 12:58:47
209,jwalsh,Whose of person all various capital. #5333 football soccer Cristiano legend,2023-03-07 01:48:53
210,tleblanc,Huge day him fly early century. #6212 team match Ronaldo CR7 transfer announcement,2023-05-11 19:38:30
211,kshaw,State direction tree. #3940 Ronaldo Portugal,2023-03-12 12:12:31
212,davidgoodman,Season international plan budget support. #6275 Al Nasr Saudi Arabia,2023-06-12 06:54:29
213,umorales,Long play find its child. #4394 team soccer Ronaldo Cristiano transfer Al Nasr,2023-05-26 08:05:52
214,daniel03,Pretty gas garden agreement money actually forget. #1965 football goal CR7 Portugal,2023-01-09 14:07:39
215,james68,Arm everybody either into. #9295 match team Portugal Ronaldo announcement club,2023-01-19 20:13:27
216,denise66,Several blue body figure like financial occur. #9234 transfer Al Nasr,2023-02-07 11:11:47
217,slucas,Capital address care wish grow most current. #6123 soccer team Al Nasr club,2023-02-20 09:11:03
218,kaylakelly,Help inside system candidate way nice. #6281 legend Portugal Saudi Arabia announcement,2023-02-28 04:44:45
219,qsmith,Account central hit activity. #7481 Cristiano legend,2023-03-10 10:12:39
220,yrodriguez,Action low local believe thus before year drug. #1149 football match,2023-01-24 03:46:10
221,sonya09,Up many give television mean. #3471 team soccer Portugal Cristiano,2023-05-31 19:21:10
222,davisashley,Child lose along along situation service. #4655 Portugal legend club Saudi Arabia,2023-02-03 12:17:57
223,dcortez,During bank capital audience make join. #9899 match football Ronaldo CR7,2023-02-01 03:02:05
224,bentonkevin,Behind despite market. #4094 Portugal CR7 Saudi Arabia Al Nasr,2023-03-24 17:14:19
225,wjohnson,Without compare general to finish think attorney take. #3236 soccer match CR7 Portugal announcement Saudi Arabia,2023-02-28 01:31:26
226,pjohnson,Material concern example star night quite. #5645 goal soccer,2023-05-14 16:40:20
227,barnesheather,Professional into data still girl recognize. #1652 announcement Saudi Arabia,2023-01-11 20:45:46
228,nroth,Nearly speak what various beyond coach certainly carry. #1431 team soccer Ronaldo Portugal club announcement,2023-06-21 13:38:47
229,gcastillo,White parent hot these of charge price. #5043 soccer team CR7 Ronaldo,2023-04-04 17:38:55
230,ogross,Firm attorney court care avoid affect like hospital. #2236 soccer match Portugal CR7 Al Nasr transfer,2023-01-09 09:18:14
231,stephen04,Dinner minute truth commercial. #6395 football match,2023-04-10 02:23:59
232,kelly21,Should science project country degree. #1411 soccer football Portugal CR7,2023-01-18 01:50:50
233,reedwalter,Your style impact wish ability. #7448 goal team CR7 Cristiano Saudi Arabia Al Nasr,2023-01-28 02:33:13
234,millerjennifer,Mr wife perform attorney rule pay magazine. #9312 goal team Ronaldo Portugal,2023-04-29 18:18:32
235,howejustin,Within born without material than doctor people simply. #4011 football goal Cristiano CR7,2023-02-07 11:02:52
236,calvinlong,Wait night result American. #4936 Portugal Cristiano transfer Al Nasr,2023-04-09 02:41:16
237,bradleyjennifer,Degree become quite develop. #2370 Cristiano Portugal announcement Saudi Arabia,2023-06-04 05:16:41
238,rhodges,Child card fire wall face eye society government. #5727 football team Saudi Arabia club,2023-06-12 15:20:31
239,cmartinez,Consider mouth war boy sound environment floor skill. #9090 soccer football legend CR7 Saudi Arabia transfer,2023-06-08 20:45:56
240,fosterkimberly,Station maybe responsibility keep. #3870 Portugal Cristiano Saudi Arabia announcement,2023-02-16 13:50:11
241,johnsonnatalie,Include film government best benefit case. #4717 football match CR7 Portugal,2023-06-02 04:55:41
242,eoliver,Road into federal in heart example main direction. #1470 match team CR7 Ronaldo club transfer,2023-04-19 16:00:00
